title,author (first last),author (last name),text,month,year,venue,edited by,form (if known),gender (if known),themes,second venue,published in (city),Magazine Type,Author Bio.
New Wars,Benjamin Griffith Brawley,Brawley,"HURL on the lance! Break up the ancient peace!
Now let the arrow hiss in air and sing;
Now let the spear-point on the armor ring;
Sound forth the call to wars that never cease!

Ye hoot the yellow Mongol from your land;
But forth to regions all his own ye go
To reap the riches of his overflow,
And just ye call the working of your hand!

Now see the scramble of the Christian host--
Them all press forward for the spoil that's won;
New wars! new wars! ris'n on the olden one--
And this, this the enlightened freeman's boast!

But greater is the strife than here would seem,
And wider realms embracing than the East,
For that is but the remnant of the feast.
I had a vision. (Was it all a dream?)

The weary Titan groaned beneath the weight
Of nations growing weaker day by day,
Whose men he deemed but men of minor clay,
And destinies he wrought for them their fate.

And why, methought, does not the giant's creed
Cast off the weaklings that would warp his might,
And leave alone the wretches in their plight?
No answer save ""I would not"" from his greed.

So freedom hails th' advance of king and queen;
The march of mind goes on o'er field and flood;
Republics curb the weak with shows of blood;
And lordly priests profess the Nazarene!

Yet hear the trumpet and the cannon's roar,
The orphan's crying and the widow's wail;
But what of them? Unfurl the sail! flay! flail!
On! on! on to the mighty breach once more!
",November,1900,Colored American ,Walter W. Wallace,Common Measure,male,"Spanish-American War, Empire",,Boston,Predom. Black,https://en.wikipedia.org/wiki/Benjamin_Griffith_Brawley,,,,,,,,,,,,,,,,,
A Picture,Olivia Ward Bush-Banks,Bush-Banks,"I drew a picture long ago —
A picture of a sullen sea;
A picture that I value now
Because it clears Life’s mystery.
My sea was dark and full of gloom;
I painted rocks of sombre hue.
My sky alone bespoke of light,
And that I painted palest blue.
But e’en across my sky of blue
Stretched troubled clouds of sodden gray,
Through which the sun shone weak and dim,
With only here and there a ray.
Around my rocks the yellow foam
Seemed surging, moaning in despair
As if the waves, their fury spent,
Left naught but desolation there.
Three crafts with fluttering sails I drew,
And one sailed near the rocks of gray,
The other on its westward course,
Went speeding out of danger’s way.
The other still outdistanced them
Where sky and water seemed to meet.
I painted that with sails full set,
And then my picture was complete.
My life was like the sullen sea,
Misfortune’s woes, my rocks of gray;
The crafts portrayed Life’s changing scenes,
The clouded sky Life’s troubled Day
I long to paint that picture o’er,
Without the rocks of sombre hue;
Without the troubled clouds of gray,
I’ll paint the sky of brightest blue.
My sea shall lay in calm repose,
No hint of surging, moaning sigh.
My crafts, unhindered by the rocks,
Shall speed in joyous swiftness by.
But this will be when brightest hours
Of hope and cheer are given me.
I’ll paint this picture when Life’s sun
Shines clear upon Prosperity.",June,1900,Colored American ,Walter W. Wallace,Common Measure,female,,,Boston,Predom. Black,https://en.wikipedia.org/wiki/Olivia_Ward_Bush-Banks,,,,,,,,,,,,,,,,,
The Christmas Reunion,Augustus M. Hodges,Hodges,"Twas a bright Christmas morning in ""Ole Kentuck"";
Aunt Sallie was busy disrobing a duck-
A featherless turkey close by her side lay,
Prepared for the dinner that bright Christmas day.
'Twas a family reunion, and Uncle Joe Moore
And his good wife Aunt Sallie, both ten and threescore,
Had gathered around them their ""girls"" and their ""boys,""
With these ""children's"" children - the grandparents' joys.
The ""girls"" (all past thirty) were helping to make
The ""sweet tater puddin's,"" the pies, and the cake;
The ""boys"" and the grand-boys the fires were making,
The oldest granddaughter the biscuits was baking,
The little grandchildren a dozen or more
Were tumbling about just outside of the door;
While Uncle Joe Moore, the venerable sire,
Sat smoking his pipe with his back to the fire.
When the clock tolled the midday the feast was complete,
And after each member had taken his seat,
The venerable sire rose up from his chair,
And with uplifted arms he offered this prayer:
""We thank Thee, our Father in heaven,"" he said,
""For the abundance of good things before us now spread;
We thank Thee, dear Lord, that I and my wife
Have been spared by thy goodness to reach an old life;
We thank Thee, of all things, the sweetest and best,
For our dear children's presence from North, South and West.
Continue Thy blessings, Thy goodness, Thy love,
And prepare us to meet Thee in heaven above.""
The grace being over the feast was begun.
The duck and the turkey were carved one by one;
The big chicken pot-pie received the same fate,
And a generous helping was piled on each plate.
After the meats came the puddings and pies;
Then how the grandchildren all opened their eyes
When one of their uncles from far Illinois
Brought out from the closet a basket of toys.
As dinner was over, the venerable sire
Rose up from his seat and stood by the fire,
Where he called to his side each lamb of his fold,
And blessed and caressed them like Jacob of old.
""What changes we've seen, Sal,"" remarked Uncle Joe,
""These years we've been married, some forty or so.
Now let me see, forty? Yes, forty-one years
Today, since we met at Uncle Bill Steer's.
I remember, ole 'oman, you looked mighty gran',
And I was then, children, er good-lookin' man.
I walked with your mother from Clayton that night,
And 'fore we got home, why I got in a fight.
Tom Scott, a 'patroller,' insulted your mother,
So I knocked him down, and Ed, his big brother.
I then asked your mother if she'd be my wife.
Her answer was: 'Yes, Joe, since you risked your life
For me up the road, and licked old Tom Scott,
Yes, I'll be your wife; why, Joseph, why not?'
But the next day, my children, my master sold me
To an ole Nigger trader' from East Tennessee,
Where I worked on a farm without seeing your mother
For eighty long days, till me and another.
Plantation hand run away and met with good luck,
For we soon found ourselves on the soil of Kentuck.
'Fore my ole master knowed I run erway
We two was married that same Christmas day.
We was married at Scottsville by ole Peter Brown,
Who was a white minister that lived in the town,
And would marry us slave folks no matter or not
If our masters was willing, if we only had got
A couple of chickens or a barrel of corn.
The very next Christmas our Lucy was born,
And the next of the past that I now can remember
Is when we moved here the following September.
Then came the war, Sal, and ole marster died,
While Missus and you, Sal, stood by his side.
Then I left you and children, and went out to fight
For the Union and Freedom one warm summer's night.
Then good Abr'am Lincoln, he sot us all free,
And we had in the county a big jubilee.
Then you boys and you girls all worked hand to hand
To buy me and your mother this house and this land.
Then some of you married, and some went out West,
While me and your mother, along with the rest,
Stayed on the old homestead and worked night and day,
A farming and trucking, and made the work pay.
We are glad for to meet you all back here once more,
And see your dear babies together, before

Sat smoking his pipe with his back to the fire.
Me and your mother (we are both old and gray)
Receive old Death's summons to call us away.
God bless you, my children, through life, is my prayer,""
And the venerable sire sat down in his chair.
The rest of the evening was passed in a measure
Receiving old friends or by chatting in pleasure
Till long after midnight, with hearts light and gay.
'Twas a happy reunion that bright Christmas day.",December,1900,Colored American ,Walter W. Wallace,,male,Slavery,,Boston,Predom. Black,https://en.wikipedia.org/wiki/Augustus_M._Hodges,,,,,,,,,,,,,,,,,
A Memorial of Frederick Douglass,C. Henry Holmes,Holmes,"He was a noble hero, born in an humble state,
But with a will like Nero, his cruel chains did break.
If in the glorious transept, worth and fitness reign,
If in the unknown regions, all are rewarded the same,
If to the hero modern, honor is rightly given,
His is a sapphired crown in the bright kingdom of heaven.
Tell of sagacious raids on the black tiller of soil,
Bringing from under-byways
Into freedom's sunshine and joy.
Tell of the noble plea the companion of martyred John Brown,
Earth but records - heaven rewards
The worthy with worthy renown.
Tell of the noble traits of character true as steel,
Tell of the fear-fraught days which every true patriot feels.
Tell of the powerful mind that forces the just decree,
Fair Ethiope placed with thee her hopes in blessed security.
Wet are the cheeks of millions; loudly do they lament,
Whence thou art swiftly riven from the mundane transient.
Death- unsatiable devourer thou checkmate of good men's
deeds,
-
Visiting earth each hour, unmindful of worldly needs,
But to thy name and prestige, posterity ever lauds,
Honor in life, happy in death, near the throne of the living God.
",September,1900,Colored American ,Walter W. Wallace,Elegy,male,Frederick Douglass,,Boston,Predom. Black,,,,,,,,,,,,,,,,,,
The Negro's Worth,Alonzo Milton Skrine,Skrine,"Who casts a slur on Negro worth, a stain on Negro fame?
Who dreads to own his Negro blood, or hear his Negro name?
Who scorns the warmth of Negro hearts [illegible] the clasp of Negro hands?
If he but shows his traitor's face, we [illegible] him where he stands.

The Negro's blood! Its crimson tide has watered hill and plain
Wherever there were wrongs to crush, or freemen's rights to gain.
No dastard thought, no cowardly fear his had it tamely by
When there were noble deeds to do [illegible] to die. 

The Negro's heart! The Negro's heart! God keeping pure and free
The fullness of its kindly thought its wealth of honest glee;
Its generous strength; its ardent faith; its uncomplaining trust;
Though every worshipped idol break and crumble into dust.

The Negro's hands! Ah, lift them up. made strong by honest toil.
The champion of the Civil War and of the Cuban soil:
Their battle swords they flash aloft, though death in front they see ;
The Negro's hands did valiant deeds tot brave Cuba free.

They bore the old flag bravely, and were there at Lincoln's call.
They stood beside the foremost rank, with the bravest of them all.
And when before the enemy's guns they held the Gray at bay —
O never could the Afric heart beat prouder than that day.

So if some proud Caucasian cavils at the darkness of your race,
Or speaks in scorn of Africa before her children's face,
Then lay aside the flag of truce, and denounce him where he stands 
For Negro's worth and Negro's fame were won by Negro's hands.


Published in Colored American Magazine, December 1900",December,1900,Colored American ,Walter W. Wallace,,male,"Civil War, Spanish-American War, Labor, Slavery, Progress and Racial Uplift",,Boston,Predom. Black,https://scalar.lehigh.edu/african-american-poetry-a-digital-anthology/charles-frederick-white-author-page,,,,,,,,,,,,,,,,,
Afro-American,Charles Frederick White,White,"O, country, 'tis of thee,
Land of the Lynching Bee,
   Of thee I sing.
How long will this base wrong
Pollute thy freedom's song?
Perpetrated by a throng
   Of heartless fiends.
My native country, thee,
How I long to be free!
   Thy name to love.
I long to se ethe time
When this most heinous crime
Will be changed to deeds divine,
   Like those above.
Let wailings swell the breeze,
And ring from all the trees:
   ""God's will be done.""
Let mortal souls awake--
Let all that breathe partake--
This spell of crimes to break,
   Ere the nation's gone.
O gracious God, to thee,
In thine all-wise mercy,
   We now appeal!
May this land soon be brought
Out of this doome it's wrought;
For long, in vain, we've sought
   Freedom to feel. ",September,1900,Colored American ,Walter W. Wallace,,male,"Lynching and Racialized Violence, Patriotism, Racism",,Boston,Predom. Black,https://scalar.lehigh.edu/african-american-poetry-a-digital-anthology/charles-frederick-white-author-page,,,,,,,,,,,,,,,,,
Neath the Crown and Maple Leaf,A.R. Abbott,Abbott,"A SIGH is breathed from million heart.
From Slavery's chains set free:
A million tongues now sadly cry,
Great teen, we weep for thee'

Our Queen is dead; for her all mourn.
In hamlet, palace, hall.
My Queen is dead!"" a warrior cries,
In a lonely Zulu Kraal.

Though high of race, in power and place.
Thy woman's love, O Queen,
O'er every land. from Britain's Isle
To Afric's sand was seen.

The lowliest found in thy domain
Justice to Truth allied;
Tyrants who boast that "" might is right.""
Soon pass beyond thy tide.

Thy virtue set a nobler goal,
Which all might seek to find;
Man calls his fellowman his friend,
Nor asks his hue or kind.

Ye heard, sad victims of man greed.
Her Sovereign voice, which said
""On Britain's sacred soul the slay
In chains shall never tread""

""Soon as the bondman's weary feet
Shall press its holy crust.
That moment he a free man stand-
This shackles fall to dust

On snow-clad [illegible] the North Star smiles
Our guide in days of grief.
But sorrow fled, and joy was found
Neath the Crown and Maple leaf

And now in solemn silence be
Bengali, Bedouin;
In palm-clad isles; 'neath Orient skies
Proud Turk and Fellaheen.

While Afric's sons, wherever found,
In free and blest manhood,
Revere the name of England's Queen:
Victoria the Good.


Published in Colored American Magazine",March,1901,Colored American ,Walter W. Wallace,"Elegy, Common Measure",male,Empire,,Boston,Predom. Black,,,,,,,,,,,,,,,,,,
Childhood's Memory,Violette Neatly Blackwell,Blackwell,"It was a dream, a dream of happiness,
A dream of love, so filled with melody ,
I scarce could breathe for its intensity :
It was a dream that only girlhood dreams.

It came upon me in the month of June,
   When all the birds were singing in the air,
   And Nature was her loveliest , and fair:
Oh ! it was sweet, too sweet to end so soon.

I'm older now and wiser, and my dreams,
   Those winged messengers of thoughts,
   Are not so youthful, nor so folly fraught:
They now are dreams that only women dream.",December,1901,Colored American,Walter W. Wallace,Common Measure,female,,,Boston,Predom. Black,https://en.wikipedia.org/wiki/Violette_Neatley_Anderson,,,,,,,,,,,,,,,,,
Holly Berry and Mistletoe: Lyrics,William Stanley Braithwaite,Braithwaite,"I.
THE trees are bare, wild flies the snow,
   Hearths are glowing, hearts are merry —
High in the air is the Mistletoe,
   Over the door is the Holly Berry.
Never have care how the winds may blow,
   Never confess the revel grows weary —
Yule is the time of the Mistletoe,
   Yule is the time of the Holly Berry.
II. 
Come trip a measure,
Let the heart be gay,
Yule grants a pleasure
None can say us nay.
Let the song be merry ,
Be it fast or slow
Hope is in the Holly -Berry,
And Love in the Mistletoe .
Of the year, the sadness
'Tis we rememberNow is time for gladness
Here in December .
High may drift the snow ,
Winds may lift and carry—
But Love comes with the Mistletoe ,
And Hope with the Holly -Berry.
III.
What makes the house so quiet today ?
Children , you really must go and play .
This is the time for holly and joys,-
Here, my pets , are your books and toys .
See , papa will blow your new horn , Ned
And shall he read a tale from your book, Fred?
And baby can rattle here on my knee
No? Won't take to my terms for a spree?
Mary, my little woman, my dear,
Come ... child be brave , brush away that tear
...Oh God ! my darlings how can we be gay,
And this, Mother's first Christmas away!
IV. 
A large bright Star came out of the East-the mystic East ,
And o'er a city shone, where men were gay with wine and feast ;
Shawms were sounded , and maidens made the lutes sweet with song,
And a cry for the King went forth from the heart of the throng .
Dancers performed for the guests with jewelled ankles and ears ,
And the riotous deep applause went forth sounding the doom of years.
A large bright Star came out of the East-the mystic East !
And shone on two who walked away from the noise of the feast .
On the hill-side the weary two , to a stable made their way ,
To share with kine the chilly place till comes the break of day .
The woman dreamed in her sleep that night , woke in pain and smiled
The dream was but the light of a Star, the coo of a little child .
V. 
December comes , snows come ,
   Comes the wintry weather ;
Faces from away come
   Hearts , must be together .
      Down the stair - steps of the hours
      Yule leaps the hills and towers-
--Fill the bowl and hang the holly,
   Let the times be jolly.
Day comes , and night comes
   And the guests assemble
Once again the old dream comes
   That I would dissemble.
      Falls a shadow 'cross the floor ,
       Seen !-and is seen no more.
O that mem'ry would forego
   The hanging of the Mistletoe .",December,1901,Colored American,Walter W. Wallace,,male,,Lyrics of Love and Laughter,Boston,Predom. Black,https://en.wikipedia.org/wiki/William_Stanley_Braithwaite,,,,,,,,,,,,,,,,,
Thanksgiving,William Stanley Braithwaite,Braithwaite,"My heart gives thanks for many things—
   For strength to labor day by day,
For sleep that comes when darkness wings
   With evening up the eastern way.
I give deep thanks that I'm at peace
   With kith and kin and neighbors, too;
Dear Lord, for all last year's increase,
   That helped me strive and hope and do.

My heart gives thanks for many things;
   I know not how to name them all.
My soul is free from frets and stings,
   My mind from creed and doctrine's thrall.
For sun and stars, for flowers and streams,
   For work and hope and rest and play,
For empty moments given to dreams—
   For these my heart gives thanks today.

Yes, Lord, my thanks for many things
   But one thing thou hast given ,is best ---
I thank thee for the song it sings,
   I thank thee for its golden crest.
Of all the gifts to man on earth
   Love is the best, the good, the great:
My soul has given a dream, love-birth:
   I thank thee for the happy state.",November,1901,Colored American ,Walter W. Wallace,,male,,"Lyrics of Love and Laughter, Dunbar Speaker and Entertainer",Boston,Predom. Black,https://en.wikipedia.org/wiki/William_Stanley_Braithwaite,,,,,,,,,,,,,,,,,
In My Garden,William Stanley Braithwaite,Braithwaite,"Today 'tis sunny June, the breeze is soft
   And pauses sweetly dying where I sit,
Here in my dear old garden where aloft
   The tuneful birds about me sing and flit.

And here today no longing breaks my calm .
  No mad desire fraught with ceaseless strife ,
For roses, lilies, aloe-balls have balm
   To sooth away the harsher thoughts of life.

This is the place to doze and sink to dreams
   As all the while the roses bud and bloom,
And sweet birds warble, and the murmuring streams.
   And honeyed bees blend in harmonious tune.

So here today this fresh green June is sweet,
   And in my garden dreaming o'er and o'er
I drowse beneath its perfume and its heat
   And fill my heart full of sweet nature's lore. ",June,1901,Colored American,Walter W. Wallace,Common Measure,male,,,Boston,Predom. Black,https://en.wikipedia.org/wiki/William_Stanley_Braithwaite,,,,,,,,,,,,,,,,,
June,William Stanley Braithwaite,Braithwaite,"Again when nature glows
   With a sweet smile of tender rirent bloom;
And when the fragrant rose
   Makes ordorous the air with its perfume;

The happy June descends
   Amid us, with her softly warbling birds,
Whose winging concert blends
   Euphonious, sounds too full and sweet for words. ",June,1901,Colored American,Walter W. Wallace,Common Measure,male,,,Boston,Predom. Black,https://en.wikipedia.org/wiki/William_Stanley_Braithwaite,,,,,,,,,,,,,,,,,
A Little World,William Stanley Braithwaite,Braithwaite,"Dear one, when we are wed in happy bliss,
   When cares and heart -aches from our lives are gone ,
No bitter strife will stoop our souls to kiss
   For peace from mated love will then be born .

A little world made up of you and I—
   We two a whole creation , soul and heart ,
Where I will be as sun in June's soft sky ,
   And thou the moon , our world's serener part .

And in our world of love will be no drouth ;
   The hours will be as flowers , fair and sweet ;
Kissed ever by soft breezes from the south
   Low-winnowed with bird songs for lovers meet .",September,1901,Colored American ,Walter W. Wallace,Common Measure,male,,,Boston,Predom. Black,https://en.wikipedia.org/wiki/William_Stanley_Braithwaite,,,,,,,,,,,,,,,,,
A Leave Taking,William Stanley Braithwaite,Braithwaite,"Love one word more
Before you go—
Some sweet, sad thing
Remembering ,
Alas, to know---
Some hope you fed, some glance you gave,
Dead, now in Love's deep grave.

So speak, and then depart,
And I will keep
The best of you forever in my heart .
All else shall sleep
As if Death came and taught me to forget .
All but the best,
That your loved memory live
In my sad breast. ",September,1901,Colored American,Walter W. Wallace,,male,,,Boston,Predom. Black,https://en.wikipedia.org/wiki/William_Stanley_Braithwaite,,,,,,,,,,,,,,,,,
Two on the Cliffs,William Stanley Braithwaite,Braithwaite,"Two on the cliffs by the purple sea,
With the waves unbound and the sea -winds free;
Wound in the mesh of its sobbing tone.
And the tangling swirl of the sun-kissed foam .
Two hand in hand by the glad, old sea,
With but one sweet dream for you and me.

The sea's soft sigh on reef and shore,
Two hearts keep rythm for ever more,
Blue of the sea and the sky are one,
And two hearts beating in unison.
O rhyme of the ages, sweep of the sea,
And two souls thrall'd in its mystery.",September,1901,Colored American,Walter W. Wallace,,male,,,Boston,Predom. Black,https://en.wikipedia.org/wiki/William_Stanley_Braithwaite,,,,,,,,,,,,,,,,,
Easter Day,William Stanley Braithwaite,Braithwaite,"Today I woke and looked upon the heath
   And odorous breath
Of lilies, and the sweet geranium,
   With the low hum

Of birds, spoke softly to my ears and said :
   ""He who was dead
Lives once again — He rose 'twixt day and night
   In samite white.

And all the morn grew flush'd in subtle bloom;
   All death's sad gloom
Vanished; and joy, as when His foot touched earth
   Sprang into birth.""

Then one did seem to stand in field nearby,
   And loudly cry:
""Step blithely midst the flow'rs, for I am He
   Of Calvary.

And when thou, too, hast borne thy cross thro' life,
   And won the strife ,
Like me, shalt thou emerge from death and rise
   With this great prize:

""Life's raiment cleansed with precious blood of mine;
   And radiant shine
Beside my Father's throne, three lilies in thine hair,
   As crown shalt wear.""",April,1901,Colored American ,Walter W. Wallace,,male,,,Boston,Predom. Black,https://en.wikipedia.org/wiki/William_Stanley_Braithwaite,,,,,,,,,,,,,,,,,
To Beatrice,William Stanley Braithwaite,Braithwaite,"The tender notes of Philomel
   Heard far in the star -lit woods ,
Are not so sweetly audible
   As the music of thy moods .
The hue of the woodland lily
   By the verge of the forest pool ,
Glows not with such chaste, sweet beauty
   As thy pure and gracious soul.

As the nightingale sings of the rose,
   So my heart sings ofthee
As the moon in the garden glows
   So glows thy soul to me.
As heart to heart inclines
   When Love's sweet skies are blue,
So Beatrice, my soul divines
That my love is all for you!",September,1901,Colored American ,Walter W. Wallace,,male,,,Boston,Predom. Black,https://en.wikipedia.org/wiki/William_Stanley_Braithwaite,,,,,,,,,,,,,,,,,
The Bells of Notre Dame,Benjamin Griffith Brawley,Brawley,"Far up in the cathedral, so they tell ,
   There lived the lonely hunch-back all day long
   No thought but of the church -bells, great and strong,
And deaf but feeling full the chorus swell:—
'Tis holiday! O! come! my Gabrielle!
   And all the rest of ye, pour out your song!
   Why stand ye idle, lagging there? Ding! dong!
O! Thibauld, sound your deep, reverberant cell!
O! Sparrows, yield the sweetness that ye bring!
   O! Pasquier, forth your piping music hurl
      To th' multitude below, and all earth fill!
Awake! awake! awake to life and sing!
   But lo! behold ! she comes, the dancing girl!
      The ringer's heart leaps, but the bells are still .",November,1901,Colored American,Walter W. Wallace,Sonnet,male,Intertext,,Boston,Predom. Black,https://en.wikipedia.org/wiki/Benjamin_Griffith_Brawley,,,,,,,,,,,,,,,,,
Prayer-Bells,Benjamin Griffith Brawley,Brawley,"When with itself the soul communion holds ,
   And speaks none other than itself and God ;
   When in the silence it doth grope and plod—
Its way thick dark till God his thoughts unfolds ;
When like unto himself the Maker molds
   Us more and more , and all the selfish clod
   Of sin recedes to ways now long since trod—
Then, when the better -self the whole enfolds ,
How sweet the distant pealing of the bells ,
   Far -sounding , whose low echo sways the soul
      And calls to meditation and to prayer!
Soft, sweet the melody that from those cells
   Goes forth to soothe the heart and onward roll
      To die upon the bosom of the air.",July,1901,Colored American ,Walter W. Wallace,Sonnet,male,Religion,,Boston,Predom. Black,https://en.wikipedia.org/wiki/Benjamin_Griffith_Brawley,,,,,,,,,,,,,,,,,
