title,author (first last),author (last name),text,month,year,venue,edited by,form (if known),gender (if known),themes,second venue,published in (city),Magazine Type,Author Bio.
Age and Autumn,William Stanley Braithwaite,Braithwaite,"Where now is the blaze that hung intense
      Through summer days?
Transmuted into another sense
      By slanting rays?
Is it your keel, O Earth, with a turn sublime
       Which changes Time
And makes the sunshine weary and mellow
And the flowers wither, and green leaves yellow?
And man, is he a flower—or a green leaf
      Whose flourish is brief?
Old Earth, sailing so even and quiet.
      Stilling the riot
In the blood of youth, is yours the blame?—
      Or does Time play your game?
Are you one. or twain, that makes autumn weather
In the body of man, or do you work in the sere together?",October,1926,Palms,Countee Cullen,,male,,,"Guadalajara, Mexico",Predom. White,"https://en.wikipedia.org/wiki/William_Stanley_Braithwaite#:~:text=William%20Stanley%20Beaumont%20Braithwaite%20(December,in%20the%20early%2020th%20century.",,,,,,,,,,,,,,,,,
The Tragedy of Pete,Joseph S. Cotter,Cotter,"There was a man
—Whose name was Pete,
And he was a buck
—From his head to his feet.
He loved a dollar,
—But hated a dime;
And so was poor
—Nine-tenths of the time.
The Judge said “Pete,
—What of your wife?”
And Pete replied
—“She lost her life.”
“Pete,” said the Judge,
—“Was it lost in a row?
Tell me quick,
—And tell me how.”
Pete straightened up
—With a hic and a sigh,
Then looked the Judge
—Full in the eye.
“O, Judge, my wife
—Would never go
To a Sunday dance
—Or a movie show.
“But I went, Judge,
—Both day and night,
And came home broke
—And also tight.
“The moon was up,
—My purse was down,
And I was the bully
—Of the bootleg town.
“I was crooning a lilt
—To corn and rye
For the loop in my legs
—And the fight in my eye.
“I met my wife;
—She was wearing a frown,
And catechising
—Her Sunday gown.
“ ‘O Pete, O Pete’
—She cried aloud,
‘The Devil is falling
—Right out of a cloud.’
“I looked straight up
—And fell flat down
And a Ford machine
—Pinned my head to the ground.
“The Ford moved on,
—And my wife was in it;
And I was sober,
—That very minute.
“For my head was bleeding,
—My heart was a-flutter;
And the moonshine within me
—Was tipping the gutter.
“The Ford, it faster
—And faster sped
Till it dipped and swerved
—And my wife was dead.
“Two bruised men lay
—In a hospital ward—
One seeking vengeance,
—The other the Lord.
“He said to me:
—‘Your wife was drunk,
You are crazy,
—And my Ford is junk.’
“I raised my knife
—And drove it in
At the top of his head
—And the point of his chin.
“O Judge, O Judge,
—If the State has a chair,
Please bind me in it
—And roast me there.”
There was a man
—Whose name was Pete,
And he welcomed death
—From his head to his feet.",July,1926,Opportunity,Charles S. Johnson,Ballad,male,Prize-winning,,New York,Predom. Black,https://en.wikipedia.org/wiki/Joseph_Seamon_Cotter_Sr.,,,,,,,,,,,,,,,,,
Lines to Certain of One's Elders,Countee Cullen,Cullen,"YOU too listless to examine
If in pestilence or famine
Death lurk least, a hungry gamin
Gnawing on you like a beaver
On a root, while you trifle
Time away nodding in the sun,
Careless how the shadows crawl
Surely up your crumbling wall,
Heedless of the Thief’s footfall,
Death’s whose nimble fingers rifle
Your heartbeats one by weary one,—
Here’s the difference in our dying:
You go dawdling, we go flying.
Here’s a thought flung out to plague you:
Ours the pleasure if we’d liever
Burn completely with the fever
Than go ambling with the ague.",June,1926,Opportunity,Charles S. Johnson,,male,,Caroling Dusk,New York,Predom. Black,https://en.wikipedia.org/wiki/Countee_Cullen,,,,,,,,,,,,,,,,,
Thoughts in a Zoo,Countee Cullen,Cullen,"They in their cruel traps, and we in ours,   
Survey each other’s rage, and pass the hours   
Commiserating each the other’s woe,   
To mitigate his own pain’s fiery glow.   
Man could but little proffer in exchange   
Save that his cages have a larger range.   
That lion with his lordly, untamed heart   
Has in some man his human counterpart,
Some lofty soul in dreams and visions wrapped,   
But in the stifling flesh securely trapped.   
Gaunt eagle whose raw pinions stain the bars   
That prison you, so men cry for the stars!
Some delve down like the mole far underground,   
(Their nature is to burrow, not to bound),
Some, like the snake, with changeless slothful eye,   
Stir not, but sleep and smoulder where they lie.   

Who is most wretched, these caged ones, or we,   
Caught in a vastness beyond our sight to see?",December,1926,The Crisis,"W.E.B. Du Bois, Jessie Fauset",Caudate sonnet,male,Prize-winning,,New York,Predom. Black,https://en.wikipedia.org/wiki/Countee_Cullen,,,,,,,,,,,,,,,,,
Confession,Countee Cullen,Cullen,"If for a day joy masters me,
   Think not my wounds are healed;
Far deeper than the scars you see
   I keep their roots concealed.
They shall bear blossoms with the fall;
   I have their word for this 
Who tend my roots with rains of gall,
   And suns of prejudice.",July,1926,Opportunity,Charles S. Johnson,"Quatrain, Common Measure",male,"Racism, Prize-winning",,New York,Predom. Black,https://en.wikipedia.org/wiki/Countee_Cullen,,,,,,,,,,,,,,,,,
From the Dark Tower,Countee Cullen,Cullen,"We shall not always plant while others reap
The golden increment of bursting fruit,
Nor always countenance, abject and mute,
That lesser men should hold their brothers cheap ;
Not everlastingly while others sleep
Shall we beguile their limbs with mellow flute,
Not always bend to some more subtle brute;
We were not made eternally to weep.
The night whose sable breast relieves the stark,
White stars is no less lovely being dark,
And there are buds that cannot bloom at all
In light, but crumple, piteous, and fall.
So in the dark we hide the heart that bleeds,
And wait, and tend our agonizing seeds.",November,1926,Fire!!,Wallace Thurman,Sonnet,male,,,New York,Predom. Black,https://en.wikipedia.org/wiki/Countee_Cullen,,,,,,,,,,,,,,,,,
A Song of Sour Grapes,Countee Cullen,Cullen,"I WISH your body were in the grave,
Deep down as a grave may be,
Or rotting under the deepest wave
That ever ploughed the sea.
I wish I never had seen your face,
Or the sinuous curve of your mouth,
Dear as a straw to a man who drowns
Or rain to a land in drouth.
I would that your mother had never borne,
Your father’s seed to fruit,
That meadow rats had gnawed his corn
Before it gathered root.",October,1926,Palms,Countee Cullen,,male,,,"Guadalajara, Mexico",Predom. White,https://en.wikipedia.org/wiki/Countee_Cullen,,,,,,,,,,,,,,,,,
No Images ,Waring Cuney,Cuney,"She does not know
Her beauty
She thinks her brown body
Has no glory
If she could dance
Naked
Under palm trees
And see her image in the river
She would know
But there are no palm trees
On the street
And dish water gives back no images",June,1926,Opportunity,Charles S. Johnson,Free verse,male,"Race: Black beauty, Prize-winning",The Carolina Magazine,New York,Predom. Black,https://en.wikipedia.org/wiki/Waring_Cuney,,,,,,,,,,,,,,,,,
The Death Bed,Waring Cuney,Cuney,"All the time they were praying
He watched the shadow of a tree
Flicker on the wall.
There is no need of prayer,
He said,
No need at all.
The kin-folk thought it strange
That he should ask them from a dying bed.
But they left all in a row
And it seemed to ease him
To see them go.
There were some who kept on praying
In a room across the hall
And some who listened to the breeze
That made the shadows waver
On the wall.
He tried his nerve
On a song he knew
And made an empty note
That might have come,
From a bird's harsh throat.
And all the time it worried him
That they were in there praying
And all the time he wondered
What it was they could be saying.",November,1926,Fire!!,Wallace Thurman,Free verse,male,,,New York,Predom. Black,https://en.wikipedia.org/wiki/Waring_Cuney,,,,,,,,,,,,,,,,,
Grave,Waring Cuney,Cuney,"When I am in my grrave
And none are there
Save those who like myself
Must sleep,
I shall wake at times
To weep.
I shall wake at times
To weep,
For I need have no fears
There
That someone see
My tears.
I need have no fears.",October,1926,Palms,Countee Cullen,Free verse,male,,,"Guadalajara, Mexico",Predom. White,https://en.wikipedia.org/wiki/Waring_Cuney,,,,,,,,,,,,,,,,,
The Mask,Clarissa Scott Delany,Delaney,"So detached and cool she is
No motion e'er betrays
The secret life within her soul,
The anguish of her days.
She seems to look upon the world
With cold ironic eyes,
To spurn emotion's fevered sway,
To scoff at tears and sighs.
But once a woman with a child
Passed by her on the street,
And once she heard from casual lips
A man's name, bitter-sweet.
Such baffled yearning in her eyes,
Such pain upon her face!
I turned aside until the mask
Was slipped once more in place.",October,1926,Palms,Countee Cullen,,female,,Caroling Dusk,"Guadalajara, Mexico",Predom. White,https://en.wikipedia.org/wiki/Clarissa_Scott_Delany,,,,,,,,,,,,,,,,,
The Song of America,W.E.B. Du Bois,Du Bois,"I doom, I live, I will,
I take, I lie, I kill!
I rend and rear
In deserts drear I build and burrow well.
With wrack and rue
I hound and hue
On founding stones in hell;
My temples rise
And split the skies.
My winged wheels do tell
The woven wonders of my hand.
The witch-work of my skill!
I writhe, I rave.
To chain the slave
I do the deed, I kill!
Now what care I
For God or Lie?
I am the great
      I WILL. ",October,1926,Palms,Countee Cullen,,male,,,"Guadalajara, Mexico",Predom. White,https://www.poetryfoundation.org/poets/w-e-b-du-bois,,,,,,,,,,,,,,,,,
Poem (O Star-Kissed drifting...),W.E.B. Du Bois,Du Bois,"O Star-kissed drifting from above.
On misty moonbeams, sunshine shod,
Dim daughter of the lips of God,
To me and angels—Thou art Love!
O Earth-dipped raining joy, and rife
With all still wonders that abide,
Ghost Mother to the Time and Tide,
To me and faery—Thou art Life.
In love and life, in wrack and ruth
A whisper on the road to hell.
High heaven's herald, ringing well
Dear Death's destruction—Thou art Truth.",October,1926,Palms,Countee Cullen,,male,,,"Guadalajara, Mexico",Predom. White,https://www.poetryfoundation.org/poets/w-e-b-du-bois,,,,,,,,,,,,,,,,,
Words! Words!,Jessie Fauset,Fauset,"How did it happen that we quarreled?
We two who loved each other so!
Only the moment before we were one,
Using the language that lovers know.
And then of a sudden, a word, a phrase
That struck at the heart like a poignard’s blow.
And you went beserk, and I saw red,
And love lay between us, bleeding and dead!
Dead! When we loved each other so!
How could it happen that we quarreled!
Think of the things we used to say!
“What does it matter, dear, what you do?
Love such as ours has to last for aye!”
—“Try me! I love to ensure your test!”
—“Love, we shall always love, come what may!”
What are the words the apostle saith?
“In the power of the tongue are Life and Death!”
Think of the things we used to say!",October,1926,Palms,Countee Cullen,,female,,Caroling Dusk,"Guadalajara, Mexico",Predom. White,https://en.wikipedia.org/wiki/Jessie_R._Fauset,,,,,,,,,,,,,,,,,
Dead Fires,Jessie Fauset,Fauset,"If this is peace, this dead and leaden thing,
Then better far the hateful fret, the sting,
Better the wound forever seeking balm
Than this gray calm!
Is this pain's surcease? Better far the ache,
The long-drawn dreary day, the night's white wake;
Better the choking sigh, the sobbing breath
Than passion's death! ",October,1926,Palms,Countee Cullen,,female,,,"Guadalajara, Mexico",Predom. White,https://en.wikipedia.org/wiki/Jessie_R._Fauset,,,,,,,,,,,,,,,,,
My Words,Frank Horne,Horne,"I would they were
.... a Pegasus herd,
And I could whip them
Flying
.... up the crest of Parnassus
With great wings outspread and all a’shine
In the morning sun. .
But instead
.... they trudge and crawl
Like any plow horse--
A sluggish pack
....their broad backs wet
And steaming
In their labor.
Their pace is so slow
In the morning sun. . . . 
",May,1926,The Crisis,"W.E.B. Du Bois, Jessie Fauset",Free Verse,male,Labor,,New York,Predom. Black,https://en.wikipedia.org/wiki/Frank_Smith_Horne,,,,,,,,,,,,,,,,,
To a Persistent Phantom,Frank Horne,Horne,"I buried you deeper last night,
You with your tears
And your tangled hair
You with your lips
That kissed so fair
I buried you deeper last night,
I buried you deeper last night,
With fuller breasts
And stronger arms
With softer lips
And newer charms
I buried you deeper last night.
Deeper .... aye, deeper
And again tonight
'Till that gay spirit
That once was you
Will tear its soul
In climbing through
Deeper .... aye, deeper
I buried you deeper last night.",July,1926,Opportunity,Charles S. Johnson,,male,Prize-winning,,New York,Predom. Black,https://en.wikipedia.org/wiki/Frank_Smith_Horne,,,,,,,,,,,,,,,,,
Joy,Langston Hughes,Hughes,"I went to look for Joy,
Slim, dancing Joy,
Gay, laughing Joy,
Bright-eyed Joy,----
And I found her
Driving the butcher's cart
In the arms of the butcher boy!
Such company, such company,
As keeps this young nymph, Joy!
",February,1926,The Crisis,"W.E.B. Du Bois, Jessie Fauset",Free Verse,male,,The Weary Blues,New York,Predom. Black,https://en.wikipedia.org/wiki/Langston_Hughes,,,,,,,,,,,,,,,,,
To Midnight Nan at Leroy's,Langston Hughes,Hughes,"Strut and wiggle,
Shameless gal.
Wouldn't no good fellow
Be your pal.
Hear dat music. . . .
Jungle night.
Hear dat music. . . .
And the moon was white.
Sing your Blues song,
Pretty baby.
You want lovin'
And you don't mean maybe.
Jungle lover. . . .
Night black boy. . . . 
Two against the moon
And the moon was joy.
Strut and wiggle,
Shameless Nan.
Wouldn't no good fellow
Be your man?",January ,1926,Opportunity,Charles S. Johnson,Quatrain,male,Music,The Weary Blues (1926),New York,Predom. Black,https://en.wikipedia.org/wiki/Langston_Hughes,,,,,,,,,,,,,,,,,
Elevator Boy,Langston Hughes,Hughes,"I got a job now
Runnin an elevator
In the Dennison Hotel in Jersey,
Job aint no good though.
No money around.
   Jobs are just chances
   Like everything else.
   Maybe a little luck now,
   Maybe not.
   Maybe a good job sometimes:
   Step out o' the barrel, boy.
Two new suits an'
A woman to sleep with.
   Maybe no luck for a long time.
   Only the elevators
   Goin' up an' down,
   Up an' down,
   Or somebody else's shoes
   To shine,
   Or greasy pots in a dirty kitchen.
I been runnin' this
Elevator too long.
Guess I'll quit now.",November,1926,Fire!!,Wallace Thurman,Free verse,male,Labor,,New York,Predom. Black,https://en.wikipedia.org/wiki/Langston_Hughes,,,,,,,,,,,,,,,,,
Railroad Avenue,Langston Hughes,Hughes,"Dusk dark
On Railroad Avenue.
Lights in the fish joints,
Lights in the pool rooms.
A box car some train
Has forgotten
In the middle of the block.
A player piano,
A victrola .
   942
   Was the number.
A boy
Lounging on the corner.
A passing girl
With purple powdered skin.
   Laughter
   Suddenly
   Like a taut drum.
   Laughter
   Suddenly
   Neither truth nor lie.
   Laughter
Hardening the dusk dark evening.
   Laughter
Shaking the lights in the fish joints,
Rolling white balls in the pool rooms,
And leaving untouched the box car
Some train has forgotten.",November,1926,Fire!!,Wallace Thurman,Free verse,male,,,New York,Predom. Black,https://en.wikipedia.org/wiki/Langston_Hughes,,,,,,,,,,,,,,,,,
Lullaby,Langston Hughes,Hughes,"(For a Black Mother)

My little dark baby,
My little earth-thing,
My little love-one,
What shall I sing
For your lullaby?
   Stars,
   Stars,
   A necklace of stars
   Winding the night.

My little black baby,
My dark body's baby,
What shall I sing
For your lullaby?
   Moon,
   Moon,
   Great diamond moon,
   Kissing the night.

Oh, little dark baby,
Night black baby,
   Stars, stars,
   Moon,
   Night stars,
   Moon,
   For your sleep-song lullaby!
",March,1926,The Crisis,"W.E.B. Du Bois, Jessie Fauset",Free Verse,male,"Motherhood, Race",,New York,Predom. Black,https://en.wikipedia.org/wiki/Langston_Hughes,,,,,,,,,,,,,,,,,
Teacher,Langston Hughes,Hughes,"Ideals are like the stars,
Always above our reach.
Humbly I tried to learn,
More humbly did I teach.
On all honest virtues
I sought to keep firm hold.
I wanted to be a good man
Though I pinched my soul.
But now I lie beneath cool loam
Forgetting every dream;
And in this narrow bed of earth
No lights gleam.
In this narrow bed of earth
Star-dust never scatters,
And I tremble lest the darkness teach
Me that nothing matters.",May,1926,Opportunity,Charles S. Johnson,Quatrain,male,,,New York,Predom. Black,https://en.wikipedia.org/wiki/Langston_Hughes,,,,,,,,,,,,,,,,,
Love Song for Lucinda,Langston Hughes,Hughes,"Love
Is a ripe plum
Growing on a purple tree.
Taste it once
And the spell of its enchantment
Will never let you be.
Love
Is a bright star
Glowing in far Southern skies.
Look too hard
And its burning flame
Will always hurt your eyes.
Love
Is a high mountain
Stark in a windy sky.
If you
Would never lose your breath
Do not climb too high.",May,1926,Opportunity,Charles S. Johnson,,male,,,New York,Predom. Black,https://en.wikipedia.org/wiki/Langston_Hughes,,,,,,,,,,,,,,,,,
Fog,Langston Hughes,Hughes,"Singing black boatmen
An August morning
In the thick white fog at Sekondi
Coming out to take Cargo
From anchored alien ships.
You do not know the fog
We strange so-civilized ones
Sail in always. ",October,1926,Palms,Countee Cullen,,male,Travel-Migration-Great Migration,,"Guadalajara, Mexico",Predom. White,https://en.wikipedia.org/wiki/Langston_Hughes,,,,,,,,,,,,,,,,,
Pictures to the Wall,Langston Hughes,Hughes,"Shall I tell you of my old, old dreams
Lost at the earth's strange turnings,
Some in the sea when the waves foamed high.
Some in a garret candle's burnings?
Shall I tell you of bitter, forgotten dreams—
You who are still so young, so young?
You with your wide brown singing eyes
And laughter at the tip of your tongue.
Shall I tell you of weary, weary dreams,—
You who have lost no dreams at all,
Or shall I keep quiet and let turn
My ugly pictures to the wall?",October,1926,Palms,Countee Cullen,,male,,,"Guadalajara, Mexico",Predom. White,https://en.wikipedia.org/wiki/Langston_Hughes,,,,,,,,,,,,,,,,,
Ruby Brown,Langston Hughes,Hughes,"She was young and beautiful
And golden like the sunshine that warmed her body.
And because she was colored
Mayville had no place to offer her,
Nor fuel for the clean flame of joy
That tried to burn within her soul.

So one day,
Sitting on old Mrs. Latham’s back porch
Polishing the silver,
She asked herself two questions.
And they ran something like this:
What can a colored girl do
On the money from a white woman’s kitchen?
And: Ain’t there any joy in this town?

Now the streets down by the river
Know more about this pretty Ruby Brown,
And the sinister shuttered houses of the Bottoms
Hold a yellow girl
Seeking an answer to her questions.
The good church folk do not mention her mame any more.

But the white men, habitués of the high shuttered houses,
Pay more money to her now than they ever did before,
When she worked in their kitchens.
",August,1926,The Crisis,"W.E.B. Du Bois, Jessie Fauset",,male,"Labor, Race, Racism, Travel-Migration-Great Migration",,New York,Predom. Black,https://en.wikipedia.org/wiki/Langston_Hughes,,,,,,,,,,,,,,,,,
The Ring,Langston Hughes,Hughes,"Love is the master of the ring
And life a circus tent.
What is this silly song you sing?
Love is the master of the ring.

I am afraid!
Afraid of Love
And of love’s bitter whip!
Afraid,
Afraid of Love
And Love’s sharp, stinging whip.

What is this silly song you sing?
Love is the master of the ring.
",April,1926,The Crisis,"W.E.B. Du Bois, Jessie Fauset",,male,,,New York,Predom. Black,https://en.wikipedia.org/wiki/Langston_Hughes,,,,,,,,,,,,,,,,,
To Beauty,Langston Hughes,Hughes,"To worship
At the altar of Beauty,
To feel her loveliness and pain,
To thrill
At the wonder of her gorgeous moon
Or the sharp, swift, silver swords
Of falling rain.

To walk in a golden garden
When an autumn sun
Has almost set,
When near-night’s purple splendor
Shimmers to a star-shine net.

To worship
At the altar of Beauty
Is a pleasure divine,
Not given to the many many
But to fools
Who drink Beauty’s wine.
Not given to the many many
But to fools
Who seek no other goddess
Nor grapes
Plucked from another’s
Vine.
",October,1926,The Crisis,"W.E.B. Du Bois, Jessie Fauset",,male,,,New York,Predom. Black,https://en.wikipedia.org/wiki/Langston_Hughes,,,,,,,,,,,,,,,,,
Song of the Sinner,Georgia Douglas Johnson,Johnson,"Just a bit of ashes
Grey, grey ashes--spent--
God! how fierce the fires burned
Down to this content.
Just a bit of ashes,
Not a single spark
Lives in this residuum
Crumbling cold and dark.
Just a bit of ashes--
To the judgment day,
I go with my memories--
Pray, sweet vrigin, pray! ",October,1926,Palms,Countee Cullen,,female,,An Autumn Love Cycle,"Guadalajara, Mexico",Predom. White,https://en.wikipedia.org/wiki/Georgia_Douglas_Johnson,,,,,,,,,,,,,,,,,
We Face the Future (1922),Georgia Douglas Johnson,Johnson,"The hour is big with sooth and sign, with errant men at war,
While blood of alien, friend, and foe imbues the land afar,
And we, with sable faces pent, move with the vanguard line.
Shod with a faith that Springtime keeps, and all the stars opine.",January,1926,Negro World,,,female,Progress and Racial Uplift,Bronze,New York,Predom. Black,https://en.wikipedia.org/wiki/Georgia_Douglas_Johnson,,,,,,,,,,,,,,,,,
Fulfillment,Helene Johnson,Johnson,"To climb a hill that hungers for the sky,
To dig my hands wrist deep in pregnant earth,
To watch a young bird, veering, learn to fly,
To give a still, stark poem shining birth.
To hear the rain drool, dimpling, down the drain
And splash with a wet giggle in the street,
To ramble in the twilight after supper,
And to count the pretty faces that you meet.
To ride to town on trolleys, crowded, teeming
With joy and hurry and laughter and push and sweat —
Squeezed next a patent-leathered Negro dreaming
Of a wrinkled river and a minnow net.
To buy a paper from a breathless boy,
And read of kings and queens in foreign lands,
Hyperbole of romance and adventure,
All for a penny the color of my hand.
To lean against a strong tree's bosom, sentient
And hushed before the silent prayer it breathes,
To melt the still snow with my seething body
And kiss the warm earth tremulous underneath.
Ah, life, to let your stabbing beauty pierce me
And wound me like we did the studded Christ,
To grapple with you, loving you too fiercely,
And to die bleeding — consummate with Life.",June,1926,Opportunity,Charles S. Johnson,,female,"Travel-Migration-Great Migration, Prize-winning",Carolina Magazine (1927),New York,Predom. Black,https://en.wikipedia.org/wiki/Helene_Johnson,,,,,,,,,,,,,,,,,
Magalu,Helene Johnson,Johnson,"Summer comes.
The ziczac hovers
'Round the greedy-mouthed crocodile.
A vulture bears away a foolish jackal.
The flamingo is a dash of pink
Against dark green mangroves,
Her slender legs rivalling her slim neck.
The laughing lake gurgles delicious music in its throat
And lulls to sleep the lazy lizard,
A nebulous being on a sun-scorched rock.
In such a place,
In this pulsing, riotous gasp of color,
I met Magalu, dark as a tree at night,
Eager-lipped, listening to a man with a white collar
And a small black book with a cross on it.
Oh Magalu, come! Take my hand and I will read you poetry,
Chromatic words,
Seraphic symphonies,
Fill up your throat with laughter and your heart with song.
Do not let him lure you from your laughing waters,
Lulling lakes, lissome winds.
Would you sell the colors of your sunset and the fragrance
Of your flowers, and the passionate wonder of your forest
For a creed that will not let you dance?",October,1926,Palms,Countee Cullen,,female,,Caroling Dusk,New York,Predom. Black,https://en.wikipedia.org/wiki/Helene_Johnson,,,,,,,,,,,,,,,,,
