title,author (first last),author (last name),text,month,year,venue,edited by,form (if known),gender (if known),themes,second venue,published in (city),Magazine Type,Author Bio.
Taint No Need O' Women Worrin' ,Waverly T. Carmichael,Carmichael,"Tain't no need o' women worrin' bout dose sorry men
Dey jest like a paper bag w'en it's full o' win'.
Dey will call us sugar pie an' will treat us nice
Till dey git us horn' wid dem fur to be dere wife.
Things will go 'long very well fur a week or two
Den you'll see 'em settin' 'round frownin' atter you;
'Tain't no need o' women worrin' 'bout dese sorry men,
Dey jest like a paper bag w'en it's full o' win'. 

See dem walkin' 'long wid you, holdin' to yo' arm—
Don' you mind 'em, dat's a stunt, dey are full o' harm.
Dey -kin tell de biggis' lies most you ever seen,
An' kin pet an' honey you like you was a queen.
One caught up wid me las' night, strutin' wid a cane,
Rais'd 'is hat an' gin a bow, ""How'd do Mis' Lizer Jane?""
I didn't axe him how he done, which wus a hint to him
Dat I perfer'd a paper bag w'en it's full o' win'. 

You better keep yo' eyes on dem, dey'll fool you if dey kin',
Den go eroun' an' make dere brag to all de other men;
Dey'll come eroun' an' talk sweet talk an' dey won' let you res'
But let 'em git you fur a wife, dey'll beat you outer bref;
W'en you see dey ain't no good, jest let 'em pas' on by,
Cause sho' as you fool 'long wid dem,—dem fools'll make you cry!
'Tain't no use o' women worrin' 'bout dese sorry men,
Dey jest like a paper bag w'en it's full o' win'. 

If I ever marry one, he sho' is got to work,
I'll not work myself to death w'ile he set an' shirk;
Many women are today sleepin' in dere graves
'Cause dey work demself's to death like dey all was slaves.
But w'at you think of Jacob Quinn,—he is mighty nice,
An' you kno' I's promis' him I would be his wife;
Let me stop my crazy talk, I kno' I love de men
If dey are like a paper bag w'en it's full o' win'.
",January,1918,The Crisis,W.E.B. Du Bois,,male,,,New York,Predom. Black,https://en.wikipedia.org/wiki/Waverley_Turner_Carmichael,,,,,,,,,,,,,,,,,
A Sonnet to the Negro Soldiers,Joseph S. Cotter,Cotter,"Dedicated to the Ninety-Second Division, U. S. National Army

They shall go down unto Life's Borderland,
Walk unafraid within that Living Hell, 
Nor heed the driving rain of shot and shell
That 'round them falls; but with uplifted hand
Be one with mighty hosts, and armed band
Against man's wrong to man- for such full well
They know. And from their trembling lips shall swell
A song of hope the world can understand.

All this to them shall be a glorious sign, 
A glimmer of that Resurrection Morn, 
When age-long Faith, crowned with a grace benign, 
Shall rise and from their blows cast down the thorn. 
Of Prejudice.  E'en through blood it be, 
There breaks this day their dawn of Liberty.
",June,1918,The Crisis,"W.E.B. Du Bois, Jessie Fauset",Sonnet,male,"World War I, Progress and Racial Uplift",,New York,Predom. Black,"https://en.wikipedia.org/wiki/Joseph_Seamon_Cotter_Sr.#:~:text=(February%202%2C%201861%20%E2%80%93%20March,American%20playwrights%20to%20be%20published.",,,,,,,,,,,,,,,,,
Desert-Bound,Georgia Douglas Johnson,Johnson,"The rain is falling steadily,
Bringing the earth relief;
While dry-eyed I remain and calm,
Amid my desert-grief.

Break! Break! ye flood-gates of mytears
All pent in agony;
Rain! rain! upon my thirsty soul,
And flood it as the sea! 
",April,1918,The Crisis,W.E.B. Du Bois,Quatrain,female,,,New York,Predom. Black,https://en.wikipedia.org/wiki/Georgia_Douglas_Johnson,,,,,,,,,,,,,,,,,
Again it is the Vibrant May,Georgia Douglas Johnson,Johnson,"Again it is the vibrant May,
  The bursting buds, the leafing trees,
   The toying fragrance of the breeze
Call to my heart in subtlest way,
Come! come, it is a holiday!

The streamlet with unending song,
  Steals soft beneath a veiling mist,
  As to some sweet alluring tryst--
While I, with inner surges strong,
Find incomplete the day, and long.

Again it is the vibrant May,
  The Springtime feror mocks my pain,
  For I am thrall to wintry rain--
Fain would I turn my eyes away,
For love alone brings holiday. 
",May,1918,The Crisis,W.E.B. Du Bois,,female,,,New York,Predom. Black,https://en.wikipedia.org/wiki/Georgia_Douglas_Johnson,,,,,,,,,,,,,,,,,
" ""War Profiles"" ",Fenton Johnson,Johnson,"I

THE breath of the harvest is in the air. The boys of Ethiopia, khaki clad, are bidding farewell to the city of their love. They are swinging the corner to the tune of 

""John Brown's body lies a-mouldering in the grave, 
But his soul goes marching on.""

We men and women of Ethiopia are waving handkerchiefs and moistening our cheeks with tear drops. It is farewell time for our young life. 

How many of these that walk so proudly behind the flag of Appomattox will the warm earth of France receive? How many will be dust to keep alive the lilies? 

Ethiopia is paying her debt to the nation that gave the world Dumas. 

II

Toussaint, old man of the mountains, is tramping the streets of Port au Prince.

""Whither do you go, Graybeard?"" challenges the sentry. 

Toussaint's voice is soft and low.

""I go to arouse the sleeping men of Ethiopia. 

""This is the hour that tries the nations and the races. 

""War is a young man's glory, an old man's remembrance.

""France is bowed in desolation. To her I dedicate the young men of my blood that she might be saved from the claw of the vulture.

""Fear not, land that exalted Bonaparte! Toussaint hears thy call.""

III

How desolate is State Street, now that war has come upon the land!

How desolate the Cabaret. Who can be gay now that the young are about to die? The pavement of a street that once held rendezvous with music is wet with tears of those who have given loved ones to the cause. 

No longer walk the merchant, lawyer, doctor, thief and toiler along the lighted path of this merry thoroughfare. The khaki makes all men one. 

Old men are peddling dreams of a new Ethiopia; old women and young women long for the laughter of State Street grown sober. 

On with lights! Death, the new jester, holds the heart of my people in the hollow of his hand. 

IV

The Armory is silent beneath a firmament of gray. 

No longer the young men bombard its walls the laughter of youth. 

The young girls, brown as the autumn landscape or yellow as the noonday glow, pass by, lonely and dejected. 

How many Novembers, how many Decembers will die before laughter again runs riot?

V

God heard his children in the night.

God turned to him who sits on His right hand and said: 

""What is this, like the wailing of music, that reaches my throne? 

""'Tis the children of the oppressed crying for succor, I have heard their prayer night and day. 

""Ethiopia is in pain, Israel is bleeding, Poland is no more, India is weary of the strange gods that infest her groves. The tomb of my Son is desecrated and Jerusalem is the dwelling place of Gentiles.

""Man has grown arrogant. The beast on him is not yet dead.

""Go, Thou Angel of Wrath, into the four corners of the earth and spill the seeds of discord!

""Freedom shall prevail""

The Angel of Wrath is riding the winds of the earth. Look up, Ethiopia, and be comforted!
",June,1918,The Crisis,W.E.B. Du Bois,Free Verse,male,"Africa, War, World War I",,New York,Predom. Black,https://en.wikipedia.org/wiki/Fenton_Johnson_(poet),,,,,,,,,,,,,,,,,
To the White Fiends,Claude McKay,McKay,"Think ye I am not fiend and savage too?
Think ye I could not arm me with a gun
And shoot down ten of you for every one
Of my black brothers murdered, burnt by you?
Be not deceived, for every deed ye do
I could match--out-match: am I not Afric's son,
Black of that black where black deeds are done?
But the Almighty from the darkness drew
My soul and said: Even thou shalt be a light
Awhile to burn on the benighted earth,
Thy dusky face I set among the white
For thee to prove thyself of highest worth;
Before the world is swallowed up in night,
To show thy little lamp; go forth! go forth!",September ,1918,Pearson's,,Sonnet,male,Lynching and Racialized Violence,The Liberator,New York,Predom. White,https://en.wikipedia.org/wiki/Claude_McKay,,,,,,,,,,,,,,,,,
Morning Light,Effie Lee Newsome (Mary Effie Lee),Newsome,"(The Dew-drier)

It is a custom in some parts of Africa for travelers into the jungles to send before them in the early morning little African boys called “Dew-driers” to brush with their bodies the dew from the high grasses—and be, perchance, the first to meet the leopard’s or hyena’s challenge—and so open the road. “Human Brooms,” Dan Crawford calls them.

Brother to the firefly—
For as the firefly lights the night
So lights he the morning—
Bathed in the dank dews as he goes forth
Through heavy menace and mystery
Of half-waking tropic dawns,
Behold a little black boy, a naked black boy,
Sweeping aside with his slight frame
Night’s pregnant tears,
And making a morning path to the light
For the tropic traveler!

Bathed in the blood of battle,
Treading toward a new morning,
May not his race—its body long bared to the world’s disdain,
Its face schooled to smile for a light to come—
May not his race, even as the dew-boy leads,
Bear onward the world toward a new day-dawn
When tolerance, forgiveness,
Such as reigned in the heart of One
Whose heart was gold,
Shall shape the earth for that fresh dawning
     After the dews of blood?
",November,1918,The Crisis,W.E.B. Du Bois,Free Verse,female,"Africa, World War I, Race, Racialized Violence",,New York,Predom. Black,https://en.wikipedia.org/wiki/Effie_Lee_Newsome,,,,,,,,,,,,,,,,,
Ballade to Paul Laurence Dunbar,Lucian Watkins,Watkins,"We would not call you, Dunbar, from your rest,
For you were weary when you sotfly sang
The lullaby that soothed your love-sweet breast,
And o'er the raptured world divinely rang,
Amid the storms of Life's tumultuous clan,
Of battle-thunders in the fateful Night
That hide the smiles of Heaven from our sight;--
Lo, while you sleep the sleep of paradise
We seek the blessed morning and its light
'Ere sleep comes down to soothe the weary eyes!'

ENVOY

Ah, Poet Paul! you ang and all is right!
We feel our soulds expanding for the flight--
Lord, help us breathe to Thee a prayer and rise
And touch Thy Truth Eternal on the Height.
'Ere sleep comes down to soothe the weary eyes!'
",December,1918,The Crisis,W.E.B. Du Bois,"Elegy, Ballade",male,"Paul Laurence Dunbar, Intertext",,New York,Predom. Black,https://poets.org/poet/lucian-b-watkins,,,,,,,,,,,,,,,,,
The Black Madonna And Her Babe,Lucian Watkins,Watkins,"She cradles him, her babe, upon her breast,
Great with this joy of all the earth most dear.
A lullaby, touched with a trembling tear.
She croons to Heaven; it is a prayer exprest
that he, her boy, may triumph in life's test.
He sleeps in dreamless peace, his listless ear
Close to her gentle heart of love sincere--
The strength that is her soul's immortal best. 
Madonna! many a son you offer up
On Truth's eternal Cross of Calvary;
And you have drunk of each's death brimming cup.
Down in the vale of God's Gethsemane.
Dear Lord! this woman and her children sup
The gall of death--for Boundless Liberty. 
",October,1918,The Crisis,W.E.B. Du Bois,Sonnet,male,"Motherhood, Religion, Progress and Racial Uplift",,New York,Predom. Black,https://poets.org/poet/lucian-b-watkins,,,,,,,,,,,,,,,,,
Star of Ethiopia,Lucian Watkins,Watkins,"Out in the night thou art the sun
Toward which thy soul-charmed children run,
The faith-high height whereon they see
The glory of their Day To Be,--
The peace at last when all is done. 

The Night is dark but, one by one,
Thy signals, ever and anon,
Smile beacon answers to their plea,
Out in the Night.

Ah, Life! thy storms these cannot shun;
Give them a hope to rest upon,
A Dream to dream eternally.
The strength of men who would be free
And win the battle-race begun,
Out in the Night. 
",August,1918,The Crisis,W.E.B. Du Bois,,male,Africa,,New York,Predom. Black,https://poets.org/poet/lucian-b-watkins,,,,,,,,,,,,,,,,,
"Go, Give the World",Otto Bohanan,Bohanan,"I do not crave to have thee mine alone, dear,
Keeping thy chamrs within my jealous sight;
Go, give the world the blessing of thy beauty,
That other hearts may share of my delight!

I do not ask, thy love should be mine only
While others falter through the dreary night;
Go, kiss the tears from some wayfarer's vision,
That other eyes may know the joy of light!

Where days are sad and skies are hung with darkness,
Go, send a smile that sunshine may be rife;
Go, give a song, a word of kindly greeting,
To ease the sorry of some lonely life!
",March,1919,The Crisis,"W.E.B. Du Bois, Jessie Fauset",Common Measure,male,,,New York,Predom. Black,https://en.wikipedia.org/wiki/Otto_Bohanan,,,,,,,,,,,,,,,,,
The Brave Son,Alston Burleigh,Burleigh,"A little boy, lost in his childish play,
Mid the deep'ning shades of the fading day,
Fancied the warrior he would be;
He scattered his foes with his wooden sword
And put to fight a mighty horde--
Ere he crept to his daddy's knee.
A soldier crawled o'er the death-stren plain,
And he uttered the name of his love, in vain,
As he stumbled over the crest;
He fought with the fierceness of dark despair
And drove the cowering for to his lair--
Ere he crept to his Father's breast. 
",March,1919,The Crisis,"W.E.B. Du Bois, Jessie Fauset",,male,World War I,,New York,Predom. Black,https://hbcudigitallibrary.auctr.edu/digital/collection/VSUD/id/293/,,,,,,,,,,,,,,,,,
In This Hour,B.B. Church,Church,"Be strong, my son!
The weakling never can secure 
The thing for which he strives. For he 
Who rests, and there supinely waits
For some chance guerdon of reward,
But waits in vain.
Be strong! Be strong!
Have faith, my son!
For if weith all thy strength, thou canst
Not feel that God is on His throne,
Nor know that all thy life is but
A prelude to a larger growth,
Thy strength were vain.
Have faith in God!
",February,1919,The Crisis,"W.E.B. Du Bois, Jessie Fauset",Free Verse,,Religion,,New York,Predom. Black,,,,,,,,,,,,,,,,,,
To Bishop Hood  ,Joseph S. Cotter,Cotter,"Pure speech, sure speech, speech that always blends
With the rugged mettle of a foe's or friend's,
Is thine, good preacher, thine.

Fair ways, rare ways, ways that lead us on 
To the fuller morning from a meager dawn,
Are thine, wise preacher, thine. 

New thought, true thought, thought that points the way
Through doubt's mists and shadows to good
God's man-wrought day,
Is thine, brave preacher, thine. 

Old faith, bold faith, faith whose anchors still
Grapple in the fastness of the sane man's will,
Is thine, firm preacher, thine. 

Far dreams, star dreams, dreams that hedge us in
From the rocks of passion and the shoals of sin,
Are thine, great preacher, thine. 

Clean life, serene life, life that knows not shame,
Life that's writ in service on the scroll of fame,
Is thine, loved preacher, thine. 
",January,1919,The Crisis,"W.E.B. Du Bois, Jessie Fauset",Elegy,male,Religion,,New York,Predom. Black,"https://en.wikipedia.org/wiki/Joseph_Seamon_Cotter_Sr.#:~:text=(February%202%2C%201861%20%E2%80%93%20March,American%20playwrights%20to%20be%20published.",,,,,,,,,,,,,,,,,
Sonnet,Alice Dunbar-Nelson,Dunbar-Nelson,"I had not thought of violets of late,
The wild, shy kind that spring beneath your feet
In wistful April days, when lovers mate
And wander through the fields in rapturous sweet,
The thought of violets meant florists’ shops,
And bows and pins, and perfumed papers fine;
And garish lights, and mincing little fops,
And cabarets and songs, and deadenign wine.
So far from the sweet real things my thoughts had strayed,
I had forgot wide fields, and clear brown streams; 
The perfect loveliness that God has made,--
Wild violets shy and Heaven-mounting dreams.
And now–unwittingly, you’ve made me dream 
Of violets and my soul’s forgotten gleam.",August,1919,The Crisis,"W.E.B. Du Bois, Jessie Fauset",Sonnet,female,,,New York,Predom. Black,https://en.wikipedia.org/wiki/Alice_Dunbar_Nelson,,,,,,,,,,,,,,,,,
The Return,Jessie Fauset,Fauset,"I that had found the way so smooth
   With gilly-flowers that beck and nod,
Now find that same road wild and steep
   With need for compass and for rod.
And yet with feet that bleed, I pant
   On blindly--stumbling back to God! ",January,1919,The Crisis,W.E.B. Du Bois,,female,Religion,"Palms, Caroling Dusk","Guadalajara, Mexico",Predom. Black,https://en.wikipedia.org/wiki/Jessie_R._Fauset,,,,,,,,,,,,,,,,,
Father Love,Leslie Pinckney Hill,Hill,"Father Love

ONE unto him does heaven grant to bend
By day and night above the creamy cheek
And dimpled smile of baby. 'Tis the meek,
Sweet privilege of mother to attend
The cradle shrine. There patience without end
Wins her a beauty words can never speak.
Her troubled joy has nothing more to seek
Where life and love in one devotion blend.

For him the roughened world, all day for him
The tyrant task, the tension of the mind.
But toil were vain as any froth or foam,
Were not that hour to come when twilight dim
Brings weariness, and father turns to find
Rest with the blessed angels of his home.",October,1919,The Crisis,"W.E.B. Du Bois, Jessie Fauset",Sonnet,male,Fatherhood,,New York,Predom. Black,https://scalar.lehigh.edu/african-american-poetry-a-digital-anthology/leslie-pinckney-hill-author-page,,,,,,,,,,,,,,,,,
The Octoroon,Georgia Douglas Johnson,Johnson,"One  drop of midnight in the dawn of life's pulsating stream
Marks her an alien from her kind, a shade amid its gleam
Forevermore her step she bends, insular, strange, apart
And none can read the riddle of her strangely warring heart.
The stormy current of her blood, beats like a mighty sea
Against the man-wrought iron bars of her captivity.
For refuge, succor, peace and rest, she seeks that humble fold
Whose every breath is kindliness, whose hearts are purest gold! ",August,1919,The Liberator,Max Eastman,Octave,female,Interracial,Bronze,New York,Predom. White,https://en.wikipedia.org/wiki/Georgia_Douglas_Johnson,,,,,,,,,,,,,,,,,
"""Shall I Say 'My Son, You Are Branded?'",Georgia Douglas Johnson,Johnson,"Shall I say, “My son, you’re branded in this country’s pageantry,
By strange subtleties you’re tethered, and no forum sets you free?”
Shall I mark the young lights fading through your soul-enchannelled eye,
As the dusky pall of shadows screen the highway of your sky?

Or shall I, with love prophetic, bid you dauntlessly arise.
Spurn the handicap that clogs you, taking what the world denies,
Bid you storm the sullen fortress wrought by prejudice and wrong
With a faith that shall not falter, in your heart and on your tongue!
",August,1919,The Crisis,"W.E.B. Du Bois, Jessie Fauset",Quatrain,female,"Racism, Motherhood",,New York,Predom. Black,https://en.wikipedia.org/wiki/Georgia_Douglas_Johnson,,,,,,,,,,,,,,,,,
Prejudice,Georgia Douglas Johnson,Johnson,"These fell miasmic rings of mist, with ghoulish menace bound,
Like noose-horizons tightening my little world around,
They still the soaring will to wing, to dance, to speed away.
And fling the soul insurgent back into its shell of clay:

Beneath incrusted silences, a seething Etna lies.
The fire of whose furnaces may sleep — but never dies!
",April,1919,The Crisis,"W.E.B. Du Bois, Jessie Fauset",,female,Racism,,New York,Predom. Black,https://en.wikipedia.org/wiki/Georgia_Douglas_Johnson,,,,,,,,,,,,,,,,,
The Barrier,Claude McKay,McKay,"I must not gaze at them although
Your eyes are dawning day;
I must not watch you as you go
Your sun-illumined way;

I hear but I must never heed
The fascinating note,
Which, fluting like a river reed,
Comes from your trembling throat;

I must not see upon your face
Love’s softly glowing spark;
For there’s the barrier of race,
You’re fair and I am dark.",July,1919,The Liberator,Max Eastman,Common Measure,male,Interracial,Harlem Shadows,New York,Predom. White,https://en.wikipedia.org/wiki/Claude_McKay,,,,,,,,,,,,,,,,,
The Tired Worker,Claude McKay,McKay,"O whisper, O my soul! The afternoon
Is waning into evening, whisper soft!
Peace, O my rebel heart! for soon the moon
From out its misty veil will swing aloft!
Be patient, weary body, soon the night
Will wrap thee gently in her sable sheet,
And with a leaden sigh thou wilt invite
To rest thy tired hands and aching feet.
The wretched day was theirs, the night is mine;
Come tender sleep, and fold me to thy breast.
But what steals out the gray clouds red like wine?
O dawn! O dreaded dawn! O let me rest
Weary my veins, my brain, my life! Have pity!
No! Once again the harsh, the ugly city.",August,1919,The Liberator,"Max Eastman, Claude McKay",Sonnet,male,Labor,Harlem Shadows,New York,Predom. White,https://en.wikipedia.org/wiki/Claude_McKay,,,,,,,,,,,,,,,,,
If We Must Die,Claude McKay,McKay,"If we must die, let it not be like hogs
Hunted and penned in an inglorious spot,
While round us bark the mad and hungry dogs,
Making their mock at our accursed lot.
If we must die, O let us nobly die,
So that our precious blood may not be shed
In vain; then even the monsters we defy
Shall be constrained to honor us though dead!
O kinsmen! we must meet the common foe!
Though far outnumbered let us show us brave,
And for their thousand blows deal one death-blow!
What though before us lies the open grave?
Like men we’ll face the murderous, cowardly pack,
Pressed to the wall, dying, but fighting back!",July,1919,The Liberator,Max Eastman,Sonnet,male,Lynching and Racialized Violence,"Harlem Shadows, Workers Dreadnought",New York,Predom. White,https://en.wikipedia.org/wiki/Claude_McKay,,,,,,,,,,,,,,,,,
Spring in New Hampshire,Claude McKay,McKay,"Too green the springing April grass,
Too blue the silver-speckled sky,
For me to linger here, alas,
While happy winds go laughing by,
Wasting the golden hours indoors,
Washing windows and scrubbing floors.
Too wonderful the April night,
Too faintly sweet the first May flowers,
The stars too gloriously bright,
For me to spend the evening hours,
When fields are fresh and streams are leaping,
Wearied, exhausted, dully sleeping.",August,1919,The Liberator,"Max Eastman, Claude McKay",,male,Labor,Spring in New Hampshire,New York,Predom. White,https://en.wikipedia.org/wiki/Claude_McKay,,,,,,,,,,,,,,,,,
Negro Dancers,Claude McKay,McKay,"I
Lit with cheap colored lights a basement den,
With rows of chairs and tables on each side,
And, all about, young, dark-skinned women and men
Drinking and smoking, merry, vacant-eyed.
A Negro band, that scarcely seems awake,
Drones out half-heartedly a lazy tune,
While quick and willing boys their orders take
And hurry to and from the near saloon.
Then suddenly a happy, lilting note
Is struck, the walk and hop and trot begin,
Under the smoke upon foul air afloat;
Around the room the laughing puppets spin
To sound of fiddle, drum and clarinet,
Dancing, their world of shadows to forget.
II
’Tis best to sit and gaze; my heart then dances
To the lithe bodies gliding slowly by,
The amorous and inimitable glances
That subtly pass from roguish eye to eye,
The laughter gay like sounding silver ringing,
That fills the whole wide room from floor to ceiling,—
A rush of rapture to my tried soul bringing—
The deathless spirit of a race revealing.
Not one false step, no note that rings not true!
Unconscious even of the higher worth
Of their great art, they serpent-wise glide through
The syncopated waltz. Dead to the earth
And her unkindly ways of toil and strife,
For them the dance is the true joy of life.
III
And yet they are the outcasts of the earth,
A race oppressed and scorned by ruling man;
How can they thus consent to joy and mirth
Who live beneath a world-eternal ban?
No faith is theirs, no shining ray of hope,
Except the martyr’s faith, the hope that death
Some day will free them from their narrow scope
And once more merge them with the infinite breath.
But, oh! they dance with poetry in their eyes
Whose dreamy loveliness no sorrow dims,
And parted lips and eager, gleeful cries,
And perfect rhythm in their nimble limbs.
The gifts divine are theirs, music and laughter;
All other things, however great, come after.",July,1919,The Liberator,Max Eastman,Sonnet,male,"Dance, Music, Harlem, Racism",The New Negro,New York,Predom. White,https://en.wikipedia.org/wiki/Claude_McKay,,,,,,,,,,,,,,,,,
Roman Holiday,Claude McKay,McKay,"Tis but a modern Roman holiday;
Each state invokes its soul of basest passion,
​Each vies with each to find the ugliest way
​To torture Negroes in the fiercest fashion.
​Black Southern men, like hogs await your doom!
White wretches hunt and haul you from your huts,
​They squeeze the babies out your women's womb,
​They cut your members off, rip out your guts!
It is a Roman holiday, and worse,
It is the mad beast risen from his lair,
​The dead accusing years' eternal curse.
​Reeking of vengeance, in fulfilment here.
​Bravo, Democracy! Hail greatest Power
That saved sick Europe in her darkest hour!",July,1919,The Liberator,Max Eastman,Sonnet,male,"Lynching and Racialized Violence, World War I",Workers Dreadnought,New York,Predom. White,https://en.wikipedia.org/wiki/Claude_McKay,,,,,,,,,,,,,,,,,
A Capitalist at Dinner,Claude McKay,McKay,"An ugly figure, heavy, overfed,
Settles uneasily into a chair;
Nervously he mops his pink bald head,
Frowns at the fawning waiter standing near.
The entire service tries its best to please 
This overpampered piece of broken-health,
Who sits there thoughtless, querulous, obese,
Wrapped in his sordid visions of vast wealth.
Great God! if creatures like this money-fool,
Who hold the service of mankind so cheap,
Over the people must forever rule,
Driving them at their will like helpless sheep—
Then let proud mothers cease from giving birth;
Let human beings perish from the earth.",July,1919,The Liberator,Max Eastman,Sonnet,male,Class,,New York,Predom. White,https://en.wikipedia.org/wiki/Claude_McKay,,,,,,,,,,,,,,,,,
