title,author (first last),author (last name),text,month,year,venue,edited by,form (if known),gender (if known),themes,second venue,published in (city),Magazine Type,Author Bio.
The Sun and the Storm King,Azalia E. Martin,Martin,"The Sun flared up in the eastern hills
   And tore the shroud of night,
The faithful guards at peep of day,
Their blushing faces hid away
   From that transcendent light.

From out his scabbard worn and old
   The Storm King drew his blade;
He blew his war horu loud and clear
And rent the silence far and near ---
   His angry host obeyed.

Thus while the day wept, dull and gray,
   That Vandals held her king;
The piercing flash from each shining blade
With the rapid rumbling their laughter made.
   Told of their revelling.

The Sun, when the Day was growing old,
   Was nearing Evening's door,
Then flung the Storm King over his crest
Who hied away to the Ocean's breast,
  The Sun was King once more.
",August ,1906,Voice of the Negro,"J.W.E. Bowen, J. Max Barber",,female,,,Atlanta,Predom. Black,https://bluetigercommons.lincolnu.edu/lll/15/,,,,,,,,,,,,,,,,,
The Comforter,Azalia E. Martin,Martin,"And yet my soul, 'tis well with thee,
Tho' scant the harvests that we till;
Hope bringeth joys; be still, be still.

What if the way be rough and hard
Sometime will come a brighter day,
Hope bringeth joy: this way, this way.

The world may wear a deepened frown --
What care thee for its coldness shown?
Hope will not leave thee all alone.

Hope, precious spark, to which I owe
The all that gives me greater will,
And bids me to be still, be still.
",September,1906,Voice of the Negro,"J.W.E. Bowen, J. Max Barber",,female,,,Atlanta,Predom. Black,https://bluetigercommons.lincolnu.edu/lll/15/,,,,,,,,,,,,,,,,,
A Mothe's Lullaby,Azalia E. Martin,Martin,"Rock-a-bye, baby, sleep on my breast,
   Nothing can harm thee here;
Rock-a-bye, baby, may sweet be thy rest,
   Angels are hov'ring near.
      Sleep, baby, sleep,
      While watch I keep,
      Father is lost on the deep.

Rock-a-bye, baby, so free now thou art,
   Peace now has come to thee,
Would that my sorrow like thine would depart
   No more to trouble me.
      Sleep, baby, sleep,
      While watch I keep,
      Father is lost on the deep

Rock-a-bye, baby, my dear little beam,
   Fast now and prone in sleep,
Care ever calleth across my dream
   O'er thy fond pleasures creep.
      Sleep, baby, sleep,
      While watch I keep,
      Father is lost on the deep.

Rock-a-bye, baby, soon labor will call
   Call me away from thee;
He will care for thee who careth for all,
   Sweet will our union be.
      Sleep, baby, sleep,
      While watch I keep,
      Father is lost on the deep.
",October,1906,Voice of the Negro,"J.W.E. Bowen, J. Max Barber",,female,Motherhood,,Atlanta,Predom. Black,https://bluetigercommons.lincolnu.edu/lll/15/,,,,,,,,,,,,,,,,,
Mystery,Azalia E. Martin,Martin,"From out the Mystic somewhere, yet unknown,
I came a stranger here, unmasked, to plan
My journey in this life, a fleeting span,
Ushered by Cosmic Law, I came alone.
And fleeting years had passed before I knew
I was; though mysteries surround me, like shroud,
I wondered not whence came a star or cloud
Or who had painted heaven a changeless blue.
Before I left my home in distant clime,
Stern Destiny had marked my humble lot.
Helpless am I, past life and form forgot,
I am an infant in the lap of Time.
The stars light worlds in God's vast firmament
That spin with rapid rate through boundless space.
All, all the universe moves on apace
Around some unseen star omnipotent.
When I have stepped on board each drifting ship
Within the fleet of planets and of stars
Sailing toward that star past earthly bars,
My journey will my waiting soul equip.
Into the mystic somewhere yet unknown,
I go some day to know another plan,
When all is ended in this fleeting span
Impelled by Cosmic Law, I go alone.
",November,1906,Voice of the Negro,J. Max Barber,,female,,,Chicago,Predom. Black,https://bluetigercommons.lincolnu.edu/lll/15/,,,,,,,,,,,,,,,,,
A Protest,Azalia E. Martin,Martin,"Ye who would stop the progress of a race,
Give ear; that race would question thee. 
So base a deed as thine belies the name of man.
This bickering that comes 'twixt clan and clan,
Let Justice rule and prejudice erase.
Ye call us enemies of thine to-day,
But when the cannon sounded far away
Calling thy fathers to the battle's din,
This enemy upon thy threshold lay
The watch dog, lest a foe should enter in.
A friend or foe was he to thee and thine?
This upward movement of a mighty host
Is ever onward still. Like Banquo's ghost

They will not down, whatever you design
To bruise and crush it with thy tyrant heel.
The day is past when we knew but to kneel.
Lost is thy purpose, as the wild bird's cry
Within a storm. Its shriek is never heard
Above the mutterings of the thunder's roar,
Though Truth and Right upon the altar lie
To see them cricified our hearts are stirred
This sacrifice but makes Ambition soar
To loftier heights, and we commit our plan
To Him who better knows each struggling clan,
To Him who rightly judges man and man. 
",December,1906,Voice of the Negro,J. Max Barber,,female,"Progress-and-Racial Uplift, Racism",,Chicago,Predom. Black,https://bluetigercommons.lincolnu.edu/lll/15/,,,,,,,,,,,,,,,,,
The Little Maiden's Curse,J. Frederick Matthews,Matthews,"What made the pale-faced father frown
And drive the girl away,
When she had come in childish glee
With his own sweet girl to play?

""Oh, papa, dear; do let her stay!""
His little daughter cried.
""Ah, no, my child!"" the father said,
And quickly turned aside.

What made the father say in scorn,
With a look that seemed so wild,
""That Thing's not fit to play with you,
My darling little child?""

'Twas only the color of her skin
That brought forth the father's scorn:
'Twas only because God made her black
The day when she was born.

O, Father of Heaven and of Love,
Will the angels say, ""Go back?""
Will they drive her away from the golden gate
Because forsooth she's black?
",September,1906,Voice of the Negro,"J.W.E. Bowen, J. Max Barber",,male,"Racism, Childhood",,Atlanta,Predom. Black,,,,,,,,,,,,,,,,,,
A Day,William H. Maxwell,Maxwell,"A day is but a little while,
Let us live it at our best,
Let every mortal wear a smile,
If winds blow East or West.

A day is short; then sing a song,
And never once complain;
While life doth last, fight on, be strong.
Spend not one day in vain.

The pris'ner in his cell at night
Longs for another day
A feeling of sadness and of fright
Beclouds his dismal way.

A day is but a little while,
Let's live it at our best
When there are no days on the file,
Then may we go to rest.
",February,1906,Voice of the Negro,"J.W.E. Bowen, J. Max Barber",,male,,,Atlanta,Predom. Black,,,,,,,,,,,,,,,,,,
Autumn,James Edward McCall,McCall,"There comes each year a season drear
Which with its frosty breath
Doth sing unto the saddened world
The monrnful song of Death.

It slays the fair and fragrant lowers
And drives the birds away
To warmer climes, 'neath distant skies,
Where all is bright and gay.

Upon the meadow's verdant for
Itlays acarpet brown;
And from the sighing, frost-kissed trees
It blows the dead leaves down.

It whistles through the naked woods.
In notes both fierce and shrill.
Which echo and reverberate
From valley, glade and hill.

The tender-hearted wint'ry clouds
Shed cold tear drops of rain,
As they behold the sad ,sad earth
O'er which fair flowers lie slain.

And as in pain and grief we view
Chilled Nature's gloomy face.
Thoughts ofthe grave file through our souls
In swift and breathless pace.

We think of dear departed friends
Gone to that other land;
And sigh to contemplate the hour
When we must cross Death's strand.

But why should we thus quake with fear
At thought of that last day?
Twere' better that we should bedeck
Our souls in pure array.",October,1906,Colored American Magazine,Fred R. Moore,,male,,,New York,Predom. Black,https://poets.org/poet/james-edward-mccall,,,,,,,,,,,,,,,,,
Three Gifts,James Edward McCall,McCall,"Blest trio of godly dowers!
Music , poetry and flowers!
By thy aid the weary soul
Glimpses its celestial goal.

When the soul doth faint and sadden,
Flowers purify and gladden:
Poetry fresh vigor rings;
And sweet music giveth wings.

Then the spirit spreads its pinions,
And from trouble's dark dominions,
With delight and rapture soars
Straight to heaven's pearly doors.

Blest trio of godly dowers'
May ye evermore be ours!
What would Life to mortals be,
Were their lives bereft of thee?

Over scenes of grief and sorrow,
Anguish , deep despair and horror,
Thou dost shed a beam so bright,
That the darkness turns to light.

Even savage hearts beat faster,
And acknowledge God as Master,
When they hear thee in sweet speech,
Of the great Creator teach.

He who values not thy treasure,
And in thee doth find no pleasure,
Worships sin and vice instead,
And his soul is truly dead.
",October,1906,Colored American Magazine,Fred R. Moore,,male,,,New York,Predom. Black,https://poets.org/poet/james-edward-mccall,,,,,,,,,,,,,,,,,
The Tell-Tale Face,James Edward McCall,McCall,"The face is but a mystic veil of glass 
Through whichmess the spirit's ev'ry changing mien
Both show as plainly as do Time's swift feet,
Which fly beneath the clock's clean, [crusted] screen.

Whenever pleasure, part, despair in hope,
Dejection, gladness, sorrow, joy or  care,
Essay as guests into the human heart,
The tell tale face proclaims that they are there.

Yet there are seasons when the countenance
By power of a wary, subtle soul,
In forced to look serene and calm, although
Beneath its surface stormy waters roll.

The smiling face that hides an aching heart
Is but a lying servant, in fine gent,
Who stands within the doorway of the soul
And tells the world, ""My master is not here.""",October,1906,Colored American Magazine,Fred R. Moore,,male,,,New York,Predom. Black,https://poets.org/poet/james-edward-mccall,,,,,,,,,,,,,,,,,
"Not Why, O Lord, But Help",Ann Melody,Melody,"Not why a few black men in bondage sold,
Did multiply like Israel did of old,
   When pressed by lash and toil;
Nor why their children, who are slaves no more,
By prejudice are bound in bondage sore
   And ground down to the soil;

Not Why, O Lord, But Help
Not why Thy will didst carve in ebony
Thy same great Image blessed by Trinity,
   As Thou in marble white;
Nor why man's will by laws and creeds decree
The lowest grade our blest estate to be;
   His mandates, our delight;

Not why one father's children are close kin;
Nor why the fruitage of a father's sin
   Set children's teeth on edge;
Nor why God given rights of Liberty
For sons of Ham an awful curse should be,
   But Japheth's privilege;

Not why, O Lord, we do not ask Thee why;
We humbly seek thy aid or else we die.
   Not why, O Lord, but help.
The surging tide of prejudice is strong
And sweeps our stanchest earthly friends along.
   Not why, O Lord, but help.

O'erhead the inky clouds obscure the sun,
And angry winds doth drive the tempest on,
   And heavy runs the sea;
O Christ! if we but scan the troubled sea,
We sink as Peter did in Galilee:
   O bid us come to Thee!

Speak Thou unto the turbid waves of strife,
Wrath-crowned and swift to stifle out our life;
   O bid the sea be still!
Bid Thou the winds to rein their chargers in
And cease their raids which aid the cause of sin;
   O bid them do Thy will!

All power is Thine in Heaven and Earth;
The wrath and might of men is but Thy mirth,
   For Thou hast made them all.
Therefore we trust not human help nor creeds,
We humbly seek the mighty power that heeds
   The smallest sparrow's fall.

Not why, O Lord, we would not ask of Thee
For Thou who bared Thine arm to make us free
   Wilt not Thine own forsake;
But help, we plead, O Lord and that Thy might
Wilt lead us through this wilderness and night
   And cause our day to break.
",December,1906,Voice of the Negro,J. Max Barber,,female,Religion: the Black Church,,Chicago,Predom. Black,,,,,,,,,,,,,,,,,,
Sonnet--Tidings of Immortality,Henry Davis Middleton,Middleton,"I stood beside the bier of the dead,
Shedding sad tears of sorrow and regret
That mortals should have ever been beset
By such a severance of life's slender thread.
But while I stooped to kiss the cold forehead
And the wan lips, now in death's rigor set,
Pausing the while to vainly fume and fret,
These tidings in the peaceful face I read:
""Stand not, my love, and sullenly shed tears,
Since life eternal crowns the soul set free
When resurrection rends the sombre sod;
But rather down upon thy knees make prayers:
Say from thy soul of immortality,
""For this good gift I fain would thank thee, God!",March,1906,Voice of the Negro,"J.W.E. Bowen, J. Max Barber",,male,,,Atlanta,Predom. Black,,,,,,,,,,,,,,,,,,
Sight vs. Faith,Gertrude Mossell,Mossell,"Her eyes beheld the hardship and the toil
That smote her race on fair Columbia's soil,
And yet a piece within her soul abode
As though God spoke and lightened all her load!",May,1906,Voice of the Negro,"J.W.E. Bowen, J. Max Barber",,female,,,Atlanta,Predom. Black,,,,,,,,,,,,,,,,,,
The Soul,Eugene Curry Nelson,Nelson,"Perhaps his skin is wholly black,
But does that truly show
That the man's soul beneath the skin
Is not as white as snow?

Perhaps the skin is purely white,
But can that truly mean
That always beneath the whitened skin,
The soul is pure and clean?

No, 'tis not the skin true manhood shows,
Nor brings the soul to view;
But our conduct toward our fellow marks
The soul as false or true!
",June,1906,Voice of the Negro,"J.W.E. Bowen, J. Max Barber",,male,Race,,Atlanta,Predom. Black,,,,,,,,,,,,,,,,,,
Paul Lawrence Dunbar (In Memoriam),Joseph Samuel Reed,Reed,"His life so earthly to be spent,
The greatest singer of his race
His Lyre, a self-made instrument,
But 'twas not commonplace;
It murmured sweetly his folk lore
In cadence all could understand;
But then, again, his lyre could soar
To heights most truly grand.

He loved his race, and sought to raise 
It to a nobler, higher plane;
Such was the burden of his praise
Aye! even the refrain,
One needs but to recall his verse
That gladdens Ethiop's sorrowings
Aye! one may say the universe --
Tis' ""When Malindy Sings."" 

His ""Strength of Gideon"" is a strength
To many halting brothers 'ways;
Its fruitage will appear at length
By bringing helpful, peaceful days.
Although the Poet has gone hence
His cheerful songs with us remain
At once aglorious recompense--
He has not lived in vain.",April,1906,Colored American Magazine,Fred R. Moore,,male,"Intertext, Paul Laurence Dunbar",,New York,Predom. Black,,,,,,,,,,,,,,,,,,
"And This, the White Man's Burden",J. N. Samuels-Belborder,Samuels-Belboder,"WE hear of divers sayings,
Read proverbs full of truth;
To greatest age we hear them,
From adolescent youth.

But that which shames all knowledge,
And Reason doth impeach,
Is this: ""The white man's burden,""
Which o'er the world they preach.

Boasting of Christian goodness,
Of Law and Equity,
They fail to live their learning
Of Moral probity.

From glutted town and province
Where fortunes are denied,
They sail the wide, wide ocean,
Till they our shores have spied.

Thither they head: and landing
With strange timidity,
Receive our native kindness
And hospitality.

Returning with the presents
Of gold and priceless
They call our lands benighted,
And would their depths explore.

Our lands of dual greatness,
Fertility and gold;—
They confiscate and claim them
With lying tongues so bold.

Their doctrines then, they teach us,
Which eager we imbibe;
But find them inconsistent,
And shameful to our tribe.

They rob our gold and diamonds,
With arms' defying power;
And to our greatest sorrow,
Our virgins they deflower.

And this, ""the white man's burden!""
To plunder, kill, deflower!
Lay waste our Native glory,
And falsely it endower!

Is this the heavy ""burden""
Throughout the world we hear?
Aye! this the boasted ""burden""
Theft, Falsehood, Arms, and Fear!

Such arrant blatant boastings
Contaminate our ear;
Such arrant blatant boastings
We hear from year to year!

And yet we hear them calmly,
Resigning all our fate,
To that great Power and Spirit,
Who Times and men placate.

Ye sons of Ethiopia,
Less boastful nations, all--
Courage! for soon such ""greatness""
Will totter, reel, and fall.

Ye Presidents and Princes,
Who guide the stately helms,
Kings of great tribes and peoples,
Throughout the world -wide realms,

Behold the rank injustice
To Ethiop's ebon sons;
The lash, the whip, the wailings,
The very blood that runs!

And this, ""the white man's burden!""--
To plunder, kill, deflower!
Lay waste our Native glory,
And falsely it endower.
",November,1906,Voice of the Negro,J. Max Barber,,male,"Empire, Racism, Intertext",,Chicago,Predom. Black,,,,,,,,,,,,,,,,,,
La Response,Alice Ward Smith,Smith,"Saint Valentine knocked at my door this morning.
He handed me a letter, dear, from you,
I fear to send one back lest he might read it,
And so I'll have to make this picture do.

It's just a little picture of my heart, love,
And see across the top I've written, ""TRUE,""
For every time it beats I love you dearer
So keep it, dear, it beats alone for you! ",February,1906,Voice of the Negro,"J.W.E. Bowen, J. Max Barber",,female,,,Atlanta,Predom. Black,,,,,,,,,,,,,,,,,,
All in All,Alice Ward Smith,Smith,"What is the morning if the dew
Only tear-drops seem to you?

What is sunshine ifits rays
Bring to mind but sultry day?

What are flowers if the eye
Only sees them fade and die?

What the maple if we see
But the spent life of the tree?

But what love in these may be,
If God's hand in all we see!",May,1906,Voice of the Negro,"J.W.E. Bowen, J. Max Barber",,female,,,Atlanta,Predom. Black,,,,,,,,,,,,,,,,,,
A Callin' Home the Cows,Alice Ward Smith,Smith,"When the shades o' night are fallin'
An' the sun has gone to rest,
When the wee young birds are cuddled
In the soft warm nest,

I love to saunter down the lane,
An' loiter on the bars,
An' look out o'er the gloomin'
For the comin' o' the stars.

'Cause just across from where I watch
Echoing thru the pine tree boughs 
I can hear sweet Nellie Master's voice
A callin home the cows.

There's a band o' music down in town
The sound comes way out here;
Sister Mandy's playin' somethin'
On the organ sweet and clear

There's a mocking bird a singin'
In the tree out there,
The brook's a gurglin' soft and low
But I don't care.

All I want to hear is that sweet voice
A echoin' thru the boughs,
Pretty Nellie Master's voice 
'A callin' home the cows.

Mother says she's been a callin' me
To bring her up some wood,
Says she don't know what come over me,
I've always been so good.

'Bout hearin'. But I just can't hear everything
Around that bloomin' house,
'Specially when the neighbors
Are 'a callin home the cows.
",November,1906,Voice of the Negro,J. Max Barber,,female,,,Chicago,Predom. Black,,,,,,,,,,,,,,,,,,
My Little Daughter,Sarah S. Stewart,Stewart,"When the evening shadows fall
Darkly over the crowded street ,
From the nursery , through the hall ,
Comes the sound of little feet.
Sweet the hour at close of day ,
When my baby comes to me,
Putting all her toys away ,
Climbing eager to my knee .
Presses tender lips to mine ,
Nestles fondly on my breast ;
Loving arms about me twine ---
How she loves to be caress'd !
Little hands so warm and soft ;
Sweet brown eyes and tresses , too ;
Cooing voice that murmurs oft ,
""Mamma , mamma , I do love 'oo!""
Oh! my precious little girl---
Priceless gift you are to me !
Earth affords no richer pearl ,
Life and love abound in thee.",April,1906,Voice of the Negro,"J.W.E. Bowen, J. Max Barber",Common Measure,female,"Motherhood, Childhood",,Atlanta,Predom. Black,,,,,,,,,,,,,,,,,,
A Happy New Year,Sarah S. Stewart,Stewart,"There dawns again a glad New Year,
A year of love and duty;
It bounds across the hills of time,
Aglow with mystic beauty.

Into the shadows of the past,
The old year has departed;
And now upon a rose -strewn way
The bright New Year has started.

The doubts and fears of ""yesterdays, ""
With all the care and sorrow,
For ever more are swallowed up
In New Year's hopeful morrow.",February,1906,Voice of the Negro,"J.W.E. Bowen, J. Max Barber",,female,,,Atlanta,Predom. Black,,,,,,,,,,,,,,,,,,
Springtime,Sarah S. Stewart,Stewart,"The lilacs and the apple trees
Are all in lovely bloom;
The balmy air is fragrant with
The flowers' sweet perfume.

The winds breathe softest music
Among the flowers and leaves;
The hallelujah chorus
Is wafted on the breeze;

For merry birds are singing
Through all the livelong day;
All nature thrills with gladness
This charming month of May.

The orchards and the meadows,
The brooks that ripple by,
The grasses and the flowers,
The lovely deep blue sky.

The little insects creeping,
All join with glad accord
In showing forth the beauty,
And praises of the Lord.

Shall human tongues be silent
While nature's voice doth sing?
Ah! no, let every mortal
A grateful anthem sing.
",June,1906,Voice of the Negro,"J.W.E. Bowen, J. Max Barber",,female,,,Atlanta,Predom. Black,,,,,,,,,,,,,,,,,,
The Clouds Rolled Away (Emancipation Song),Asa Thompson,Thompson,"Here on this festal day
Our hearts are light and free,
The clouds have rolled away,
And shines fair liberty.

CHORUS.

Hurrah! Hurrah! Hurrah for the flag,
The bonny, bonny blue!
Hurrah! Hurrah! for the flag!
Through which the bullets flew!

All praise to Thee, O God,
All praise to Thee who broke
The fetters and the rod
Of slavery's galling yoke. CHORUS

All honor to the true,
The men who fought and died,
The boys who wore the blue
Their country's love and pride. CHORUS

We honor, too, the men
Who steered the ship of State,
They gave their tongue and pen
To stay the hand of fate.

The women too must share
The glory of this day
It is their answered prayer, 
The clouds are rolled away. СHORUS.
",January,1906,Voice of the Negro,"J.W.E. Bowen, J. Max Barber",,male,"Civil War, Music, Patriotism, Slavery",,Atlanta,Predom. Black,,,,,,,,,,,,,,,,,,
A Remarkable Epitaph,(Anonymous),(Anonymous),"""God wills us free; man wills us slaves.
I will as God wills; God's will be done.
Here lies the body of John Jack,
A native of Africa who died March, 1773, aged about sixty years.
Though born in a land of slavery,
He was born free.
Though he lived in a land of liberty,
He lived a slave;
Till by his honest though stolen labour,
He acquired the source of slavery,
Which gave him his freedom;
Though not long before Death, the great tyrant,
Gave him his final emancipation,
And put him on a footing with kings.
Though a slave to vice,
He practised those virtues
Without which kings are but slaves.""
",May,1907,Voice of the Negro,J. Max Barber,,,"Slavery, Africa",,Chicago,Predom. Black,,,,,,,,,,,,,,,,,,
A Punished Pun,Langston Aray,Aray,"A story of the butter 
And a story of the fly.
Would give you comprehension,
If someone would reply.

The fly was on the butter
And the butter on the fly:
If the butter had the wings on it
It couldn't help but fly.

They say the little wooly worm,
Or caterpillar spry—-
That creeps along the trees of shade,
Make every butter-fly.

Now, if he makes the butterfly
He ought to be a fly:
But if he hasn't got the wings,
Where does the butterfly?

On buckwheat cakes, hot biscuits,
On batter cakes, in pies;
This pun is understanding
The fly in butterflies.",June,1907,Colored American Magazine,Fred R. Moore,,male,,,New York,Predom. Black,,,,,,,,,,,,,,,,,,
Uncle Joe on Shakespeare,A. Ashburn,Ashburn,"Shakespeare wuz a poet,
Dat had a pop'lar name,
I recken eberybody
Hab heard ob his great fame.

He useter talk 'bout honor
An 'writ erbout hit's worth,
Said a good name wuz better
Dan enyting on earth.

Said houses, lands, an' all sich t'ings
Yas! I t'ink he took in cash,—
W'an't de objec' ob dis life,
He simply called 'em trash.

He eben went far 'nuff ter say.
An ' bout hit he wuz sho',
By takin' al' his wealth fum him
Yer couldn't make 'im po.'

""De precious jewel uv my sol'
Am ma name ""he useter squall,
""An' him dat steals dat 'way fum me
Hab robbed me uv my all.""

I hate ter spute dat gent'mun,
Er call to him to halt
Hits mighty strange fer me ter be
Wid him a findin' fault.

But ef he wuz libin' now
An' seen t'ings mov' erlong,
An' seen des what's a-gwine on,
He'd sing ernudder song.

Dat t'ing is dun been turned eroun',
De name am now de trash,
An' ter make one po' in dis good day
You're got ter steal his cash.
",July,1907,Voice of the Negro,J. Max Barber,,male,"AAVE, Intertext",,Chicago,Predom. Black,,,,,,,,,,,,,,,,,,
